Job Title,Company Name,Location,Experience (Years)
Service Engineer,Waytogo Consultants Pvt Ltd,Bengaluru / Bangalore,1 - 4 Years
Data Scientist Job in Canada,EXOTIC EXPERT SOLUTIONS LLP,Canada,3 - 7 Years
Software Engineer Jobs in  Abroad,TALENT VAULT LLP,"Australia,  Canada,  New Zealand,  Singapore,  null",3 - 8 Years
Lead Platform Engineer  ( Azure Kubernetes Services ),TALPRO INDIA PRIVATE LIMITED,Bengaluru / Bangalore,5 - 15 Years
Flutter Internship in Ahmedabad,Maxgen Technologies,"Ahmedabad,  Bhavnagar,  Junagarh,  Rajkot,  Surendranagar",0 - 1 Years
Data Science Internship in Ahmedabad,Maxgen Technologies,"Ahmedabad,  Bhavnagar,  Junagarh,  Rajkot,  Surendranagar",0 - 1 Years
Software Engineer Hiring For AUSTRALIA,ADAL IMMIGRATIONS LLP,Australia,5 - 10 Years
Hardware Engineer Hiring For AUSTRALIA,ADAL IMMIGRATIONS LLP,Australia,5 - 10 Years
Hardware  Engineer  Job In USA,World wide Immigration Service Llp,,5 - 10 Years
"ERP Software Engineer , Software Developer",ExponentJobs,,5 - 9 Years
Network  Engineer  Job In  GULF,World wide Immigration Service Llp,"Abu Dhabi,  Dubai,  null",4 - 8 Years
Required HR Manager,Sparks To Ideas,Ahmedabad,0 - 1 Years
Electrical Testing Technician,ASMACS,Other City(s) in Saudi Arabia,3 - 5 Years
Radiologist,Space COnsultant,Agra,1 - 6 Years
Procurement  Manager  Job In ABROAD,World wide Immigration Service Llp,"Canada,  Singapore,  null,  null,  null",2 - 7 Years
Sr. Executive  /  Asst. Manager  ( Apparel Sales )  @ Sunrise,Space COnsultant,"Bengaluru / Bangalore,  Chennai,  Delhi,  Mumbai",4 - 9 Years
SAP FI Application Lead,eSkillport HR Services Pvt. Ltd,Kolkata,8 - 10 Years
Audience Platform Lead- Salesforce Data Cloud - J48483,SAMPOORNA CONSULTANTS PVT LTD,"Bengaluru / Bangalore,  Gurgaon,  Mumbai,  Pune",7 - 10 Years
Carpenter,ASMACS,Dubai,3 - 5 Years
c# Developer - J48502,SAMPOORNA CONSULTANTS PVT LTD,Mumbai,3 - 6 Years
Golang Developer - J48509,SAMPOORNA CONSULTANTS PVT LTD,Mumbai,2 - 4 Years
Network Engineer,Sunbridge Solutions  Opc Private Limited,"Germany,  Ireland,  Netherlands,  New Zealand,  Singapore",2 - 7 Years
Software Engineer Job In NEW ZEALAND,ADAL IMMIGRATIONS LLP,New Zealand,4 - 8 Years
Oracle CC & B Techno / Functional Consultant For Immediate joining,White Horse Manpower Consultancy P Ltd,Other City(s) in Saudi Arabia,5 - 10 Years
CONSULTANT - SAP BUSINESS ONE,Options & Ideas,Kolkata,6 - 11 Years
"""Chartered Accountant"" , C.A. , CA",Next Step Associates,,2 - 4 Years
MANAGER – PLANNING  &  BILLING,Suman kumar,"Delhi/NCR,  Hyderabad/Secunderabad,  Kolkata,  Pune,  Lucknow",15 - 20 Years
Marketing Analyst - Remote - US Market,EDGESYS INC.,"Bengaluru / Bangalore,  Delhi/NCR,  Mumbai,  Noida/Greater Noida,  Pune",4 - 9 Years
Java Kotlin-Senior Specialist - Software Engineering,LTIMindtree Ltd.,Gurgaon,8 - 12 Years
Software  Engineer  Required In ABROAD,World wide Immigration Service Llp,"Dubai,  Canada,  Germany,  null,  null",2 - 7 Years
"""Angular Developer"" , Software Developer",SHREE ADISHAKTHI CONSULTANCY,Bengaluru / Bangalore,5 - 8 Years
Power Platform Developer,D B Consultancy,"Bengaluru / Bangalore,  Pune",5 - 10 Years
"Finance Manager , Jobs in Abroad",TALENT VAULT LLP,"Australia,  Canada,  New Zealand,  Singapore",3 - 8 Years
Store Head,Ample Leap Cognition,"Chennai,  Hosur,  Other City(s) in Tamil Nadu",11 - 15 Years
Admin Manager  Job In HONG KONG,PRIMEX IMMIGRATION LLP,Hong Kong,5 - 10 Years
Network  Engineer  Job In  NEW ZEALAND,World wide Immigration Service Llp,New Zealand,5 - 10 Years
Data Science Internship in Ahmedabad,Maxgen Technologies,"Ahmedabad,  Bhavnagar,  Junagarh,  Rajkot,  Surendranagar",0 - 1 Years
D365 F and O Finance Functional Consultant  ( Mid to Sr. )  - J48499,SAMPOORNA CONSULTANTS PVT LTD,Pune,5 - 9 Years
Application Specialist,SKYWALK VISA IMMIGRATION SERVICES LLP,"Australia,  Singapore,  null,  null",2 - 7 Years
Network Engineer   Job In POLAND,EXOTIC EXPERT SOLUTIONS LLP,,5 - 10 Years
Network Engineer Job In USA,ADAL IMMIGRATIONS LLP,,5 - 10 Years
PHP Developer Job  In HONG KONG,PRIMEX IMMIGRATION LLP,Hong Kong,3 - 8 Years
QA | QC Engineer  Job In NEW ZEALAND,World wide Immigration Service Llp,New Zealand,4 - 8 Years
Angular Developer  ( 2-3 Yrs )  - J48532,SAMPOORNA CONSULTANTS PVT LTD,Mumbai,2 - 3 Years
TPRM - A Con / Con / Manager - J48494,SAMPOORNA CONSULTANTS PVT LTD,Bengaluru / Bangalore,2 - 7 Years
Field Sales,Mart2Global,Ahmedabad,1 - 5 Years
PHP Developer Job In  MALTA,PRIMEX IMMIGRATION LLP,,8 - 13 Years
Quantitative Trader - J48242A,SAMPOORNA CONSULTANTS PVT LTD,Bengaluru / Bangalore,2 - 5 Years
Software Engineer  Job In AUSTRALIA,World wide Immigration Service Llp,Australia,5 - 10 Years
"""network engineer""",Next Step Associates,Ahmedabad,2 - 6 Years
BSE / FC-finance sector-orissa,LINEUP MANPOWER SOLUTIONS PRIVATE LIMTED,"Bhubaneshwar,  Cuttack,  Rourkela,  Other City(s) in Orrisa",1 - 3 Years
Teacher  Job In NETHERLANDS,EXOTIC EXPERT SOLUTIONS LLP,Netherlands,5 - 10 Years
Anesthesiologist ( For medical college ),Space COnsultant,Other City(s) in Uttar Pradesh,0 - 3 Years
Mechanical Engineer Overseas job,SKYWALK VISA IMMIGRATION SERVICES LLP,"Australia,  Canada,  Germany,  Netherlands,  null",2 - 7 Years
"""c"" , c ++",KANDPAL CONSULTANT,"Ahmedabad,  Bengaluru / Bangalore,  Chennai,  Delhi,  Hyderabad/Secunderabad",4 - 5 Years
Network Engineer   Job In NETHERLANDS,EXOTIC EXPERT SOLUTIONS LLP,Netherlands,5 - 10 Years
Hardware Engineer Job In MALTA,ADAL IMMIGRATIONS LLP,,5 - 10 Years
Android Internship in Ahmedabad,Maxgen Technologies,"Ahmedabad,  Anand,  Gandhinagar,  Mehsana,  Surat",0 - 1 Years
FIX - Java developer,Element Skill,"Bengaluru / Bangalore,  Hyderabad/Secunderabad,  Mumbai,  Pune",5 - 10 Years
MIS Executive | Senior MIS Analyst  Job In UAE,PRIMEX IMMIGRATION LLP,,3 - 8 Years
Sales  /  Marketing Managers,Navyah Immigration Services Private Limited,"Australia,  Canada,  Hong Kong,  New Zealand",2 - 7 Years
Azure Infrastructure Architect - J48247A,SAMPOORNA CONSULTANTS PVT LTD,Bengaluru / Bangalore,20 - 25 Years
Network Engineer Job In  UAE,PRIMEX IMMIGRATION LLP,,3 - 8 Years
c ++ Routing Developer,Element Skill,"Bengaluru / Bangalore,  Hyderabad/Secunderabad,  Mumbai,  Pune",5 - 10 Years
Doctor  Job In SINGAPORE,World wide Immigration Service Llp,Singapore,3 - 8 Years
Electrician,ASMACS,Dubai,4 - 6 Years
Required HR Manager,Sparks To Ideas,Ahmedabad,0 - 1 Years
Cyber Security Engineer - J48515,SAMPOORNA CONSULTANTS PVT LTD,Pune,4 - 9 Years
Lead Analyst- Semiconductor,Element Skill,Pune,5 - 10 Years
Microsoft Dynamics NAV / BC Techno Funcitonal Consultant - J48441,SAMPOORNA CONSULTANTS PVT LTD,Pune,8 - 13 Years
UX | UI Designer Job In AUSTRALIA,EXOTIC EXPERT SOLUTIONS LLP,Australia,3 - 8 Years
PHP Developer Job In UAE,PRIMEX IMMIGRATION LLP,,3 - 8 Years
Hardware Engineer  Job In  DUBAI,ADAL IMMIGRATIONS LLP,Dubai,2 - 7 Years
Network Engineer Job In  GERMANY,PRIMEX IMMIGRATION LLP,Germany,4 - 8 Years
Team Manager,Anuj saklani,Delhi/NCR,15 - 20 Years
Java Kotlin-Senior Specialist - Software Engineering,LTIMindtree Ltd.,Gurgaon,8 - 12 Years
Flutter Internship in Ahmedabad,Maxgen Technologies,"Ahmedabad,  Bhavnagar,  Junagarh,  Rajkot,  Surendranagar",0 - 1 Years
"""Java Backend Developer""",KANDPAL CONSULTANT,"Delhi,  Delhi/NCR",4 - 8 Years
Hardware  Engineer  Job In NEW ZEALAND,World wide Immigration Service Llp,New Zealand,3 - 8 Years
QA | QC Engineer  Job In NEW ZEALAND,World wide Immigration Service Llp,New Zealand,3 - 8 Years
PHP Developer Job In  GERMANY,PRIMEX IMMIGRATION LLP,Germany,3 - 8 Years
MIS Executive | Senior MIS Analyst  Job In HONG KONG,PRIMEX IMMIGRATION LLP,Hong Kong,4 - 8 Years
Talent Acquisition Executive,Waytogo Consultants Pvt Ltd,Pune,1 - 2 Years
Bank Manage   Job In  MALTA,ADAL IMMIGRATIONS LLP,,3 - 8 Years
Inside sales executive,Waytogo Consultants Pvt Ltd,Hyderabad/Secunderabad,1 - 2 Years
Mern Stack Internship in Ahmedabad,Maxgen Technologies,"Ahmedabad,  Anand,  Gandhinagar,  Mehsana,  Surat",0 - 1 Years
.net integration Lead - J48042A,SAMPOORNA CONSULTANTS PVT LTD,Chennai,8 - 13 Years
Blockchain Engineer,SKYWALK VISA IMMIGRATION SERVICES LLP,"Australia,  New Zealand,  Singapore,  null,  null",2 - 7 Years
Lead Software Engineer -Python - J48456,SAMPOORNA CONSULTANTS PVT LTD,Chennai,5 - 9 Years
Software Engineer  Job In NEW ZEALAND,World wide Immigration Service Llp,New Zealand,5 - 10 Years
Developer  ( Guidewire / Mulesoft ),One World,"Ahmedabad,  Bengaluru / Bangalore,  Chennai,  Gurgaon,  Mumbai",5 - 10 Years
Warehouse Manager jobs in Canada,TALENT VAULT LLP,"Australia,  Canada,  New Zealand,  Singapore",3 - 8 Years
Team  Manager Job In MALTA,ADAL IMMIGRATIONS LLP,,5 - 10 Years
FMCG   Manager  Job In GERMANY,World wide Immigration Service Llp,Germany,3 - 8 Years
BDE /  Marketing Analyst @ Remote - #547,EDGESYS INC.,"Ahmedabad,  Bengaluru / Bangalore,  Delhi/NCR,  Mumbai,  Pune",5 - 10 Years
B2B Sales Officer,TEKPILLAR SERVICES PRIVATE LIMITED,"Amritsar,  Bathinda,  Chandigarh,  Hoshiarpur,  Jalandhar",2 - 5 Years
Digital Marketing - J46184,SAMPOORNA CONSULTANTS PVT LTD,Mumbai,1 - 5 Years
Senior Production Designer - MA - J48348,SAMPOORNA CONSULTANTS PVT LTD,Bengaluru / Bangalore,4 - 7 Years
Senior Documentation Specialist,Horizen,Other City(s) in West Bengal,5 - 7 Years
Network  Engineer  Job In GERMANY,World wide Immigration Service Llp,Germany,3 - 8 Years
Lab Technician Job in Abroad,TALENT VAULT LLP,"Australia,  Canada,  New Zealand,  Singapore",4 - 9 Years
Urgent Hiring For Gynecologist UP Agra,Space COnsultant,Other City(s) in Uttar Pradesh,1 - 6 Years
FMCG Manager Jobs in Germany,TALENT VAULT LLP,"Australia,  Canada,  New Zealand,  Singapore",3 - 8 Years
Sales executive,Waytogo Consultants Pvt Ltd,Hyderabad/Secunderabad,1 - 2 Years
FC-finance -Ranchi,LINEUP MANPOWER SOLUTIONS PRIVATE LIMTED,Ranchi,1 - 3 Years
Graphic Designer Job in Canada,EXOTIC EXPERT SOLUTIONS LLP,Canada,3 - 7 Years
Integration Lead - J48511,SAMPOORNA CONSULTANTS PVT LTD,Hyderabad/Secunderabad,10 - 15 Years
Senior PBCS Consultant,TALPRO INDIA PRIVATE LIMITED,Bengaluru / Bangalore,5 - 15 Years
PHP Developer Job In  UAE,PRIMEX IMMIGRATION LLP,,4 - 8 Years
Senior Graphic Designer,Career Job Solution,"Mumbai,  Nagpur,  Navi Mumbai",5 - 10 Years
Java Developer,LDT TECHNOLOGY,Other City(s) in Punjab,6 - 10 Years
Web Designer  Required In UNITED KINGDOM,PRIMEX IMMIGRATION LLP,,5 - 10 Years
Hardware Engineer Job In USA,ADAL IMMIGRATIONS LLP,,4 - 8 Years
UX | UI Designer Job In  UNITED KINGDOM,EXOTIC EXPERT SOLUTIONS LLP,,3 - 8 Years
Network  Engineer  Job In SINGAPORE,World wide Immigration Service Llp,Singapore,3 - 8 Years
Librarian  Job In NEW ZEALAND,EXOTIC EXPERT SOLUTIONS LLP,New Zealand,3 - 8 Years
Lab Technician  Job In CANADA,World wide Immigration Service Llp,Canada,4 - 8 Years
Purchase  Manager  Job In MALTA,World wide Immigration Service Llp,,2 - 7 Years
Urgent opening for Business Associate Sales Position:,Osaka International,"Delhi,  Mumbai,  Valsad -Vapi",1 - 3 Years
Gifting - Purchase Manager,Suresh Gopalan Acharya,Mumbai,3 - 6 Years
Chiller Technician,ASMACS,Dubai,3 - 5 Years
Automation Engineer- - J48501,SAMPOORNA CONSULTANTS PVT LTD,"Mumbai,  Pune",4 - 7 Years
c ++ Developer -  ( Rotational Shift )  - J48518,SAMPOORNA CONSULTANTS PVT LTD,Mumbai,5 - 8 Years
Senior Consultant - System Management,LTIMindtree Ltd.,Navi Mumbai,3 - 6 Years
Network  Engineer  Job In SINGAPORE,World wide Immigration Service Llp,Singapore,3 - 8 Years
SAP Time Off- Software Engineering Professional - J48438,SAMPOORNA CONSULTANTS PVT LTD,Bengaluru / Bangalore,3 - 8 Years
Java Kotlin-Senior Specialist - Software Engineering,LTIMindtree Ltd.,Gurgaon,8 - 12 Years
SAP Business one,Options & Ideas,Kolkata,0 - 3 Years
Remote Oracle EPM ARCS Senior Consultant,TALPRO INDIA PRIVATE LIMITED,Bengaluru / Bangalore,5 - 15 Years
Hardware Engineer  Job In  MALTA,ADAL IMMIGRATIONS LLP,,4 - 8 Years
Software Engineer Job In  MALTA,ADAL IMMIGRATIONS LLP,,3 - 8 Years
Business Development Manager,TEKPILLAR SERVICES PRIVATE LIMITED,"Mumbai,  Pune,  Navi Mumbai,  Thane",2 - 7 Years
Librarian  Job In SINGAPORE,EXOTIC EXPERT SOLUTIONS LLP,Singapore,5 - 10 Years
Finance  Manager  Job  In  USA,PRIMEX IMMIGRATION LLP,,6 - 11 Years
Radiologist,Space COnsultant,Other City(s) in Haryana,1 - 6 Years
Network  Engineer  Job In LUXEMBOURG,World wide Immigration Service Llp,,3 - 8 Years
"Punching  &  Lining operator Cum Supervisor ,  Loc- Ghana",ExponentJobs,,5 - 10 Years
Final Year Project Internship,Sparks To Ideas,"Ahmedabad,  Bhavnagar,  Gandhinagar,  Junagarh,  Rajkot",0 - 1 Years
Data Science Internship in Ahmedabad,Maxgen Technologies,"Ahmedabad,  Bhavnagar,  Junagarh,  Rajkot,  Surendranagar",0 - 1 Years
Vmc Machine Operator,SKYWALK VISA IMMIGRATION SERVICES LLP,"Australia,  New Zealand,  Singapore,  null,  null",2 - 7 Years
Prompt Engineer - Con - Bangalore - J48237,SAMPOORNA CONSULTANTS PVT LTD,Bengaluru / Bangalore,4 - 6 Years
Hardware Engineer Job In USA,ADAL IMMIGRATIONS LLP,,5 - 10 Years
UX | UI Designer Job In SINGAPORE,EXOTIC EXPERT SOLUTIONS LLP,Singapore,5 - 10 Years
PHP Developer Job In USA,PRIMEX IMMIGRATION LLP,,4 - 8 Years
Sales  Manager  Job In GERMANY,World wide Immigration Service Llp,Germany,3 - 8 Years
Senior Graphic Designer - JH - J48350,SAMPOORNA CONSULTANTS PVT LTD,Bengaluru / Bangalore,4 - 7 Years
DTP Operator,SAPPHIRE INDIA PUBLISHERS PVT. LTD.,Gurgaon,1 - 2 Years
Hitachi Storage Administration,LTIMindtree Ltd.,Bengaluru / Bangalore,8 - 12 Years
Cobol Developer,Waytogo Consultants Pvt Ltd,Kolkata,3 - 6 Years
Senior Oracle FUSION Finance  FUNCTIONAL consultants,Hucon Solutions India Pvt ltd,"Ahmedabad,  Bengaluru / Bangalore,  Chennai,  Delhi,  Pune",10 - 15 Years
Flutter Internship in Ahmedabad,Maxgen Technologies,"Ahmedabad,  Bhavnagar,  Junagarh,  Rajkot,  Surendranagar",0 - 1 Years
SAP ABAP Consultant,Aadis Jobs,Agra,3 - 8 Years
Software Engineer  Job In USA,World wide Immigration Service Llp,,5 - 10 Years
Haryana ( Kalayat Kaithal District ),Space COnsultant,Other City(s) in Haryana,0 - 3 Years
MIS Executive | Senior MIS Analyst Job In Australia,CLOUD VISA IMMIGRATION LLP,Australia,3 - 8 Years
Electronics Engineer,Sudeep Consultancy,Nasik,3 - 5 Years
Software Developer Job in Canada,EXOTIC EXPERT SOLUTIONS LLP,Canada,3 - 7 Years
Golang Developer - J48509,SAMPOORNA CONSULTANTS PVT LTD,Mumbai,2 - 4 Years
"Spanish Language Instructor , Spanish Language Teacher",SHREE ADISHAKTHI CONSULTANCY,Bengaluru / Bangalore,2 - 5 Years
Senior Quality Assurance 3D Artist - J48227,SAMPOORNA CONSULTANTS PVT LTD,"Bengaluru / Bangalore,  Chennai",6 - 11 Years
.net  API + Azure- ( UK )  - Con- BLR - J48411,SAMPOORNA CONSULTANTS PVT LTD,Bengaluru / Bangalore,5 - 6 Years
PHP Developer Required In UNITED KINGDOM,PRIMEX IMMIGRATION LLP,,5 - 10 Years
Marketing Manager,Hardicon Limited,Noida/Greater Noida,4 - 5 Years
Customer Service Executive,Suresh Gopalan Acharya,Mumbai,2 - 7 Years
Purchase  Manager  Job In POLAND,World wide Immigration Service Llp,,4 - 8 Years
Sales  Manager  Job In POLAND,World wide Immigration Service Llp,,4 - 8 Years
GM MEP PROJECTS,Suman kumar,"Chennai,  Gurgaon,  Pune,  Ahmedabad,  Bhopal",10 - 15 Years
.net Core Developer - J48505,SAMPOORNA CONSULTANTS PVT LTD,Mumbai,1 - 4 Years
Android Developer - J48517,SAMPOORNA CONSULTANTS PVT LTD,Mumbai,5 - 7 Years
Backend Sales Support Executive,Waytogo Consultants Pvt Ltd,Bengaluru / Bangalore,0 - 3 Years
SEO Executive,Techno Wise,Ahmedabad,1 - 3 Years
Sr Python Developer - J48410,SAMPOORNA CONSULTANTS PVT LTD,Chennai,8 - 13 Years
Specialist - Package Implementation,LTIMindtree Ltd.,Chennai,5 - 8 Years
Costing Engineer,Multilink Management Consultant Pvt Ltd,Abu Dhabi,10 - 15 Years
Network  Engineer Job In POLAND,World wide Immigration Service Llp,,4 - 8 Years
Assistant Manager,TORRENT POWER LIMITED,Ahmedabad,10 - 12 Years
Finance  Manager  Required In GERMANY,PRIMEX IMMIGRATION LLP,Germany,4 - 8 Years
Area Sales Manager,TEKPILLAR SERVICES PRIVATE LIMITED,"Bikaner,  Kota",1 - 5 Years
OCI Service Reliability Engineer,TALPRO INDIA PRIVATE LIMITED,Bengaluru / Bangalore,5 - 15 Years
"""DIGITAL MARKETING EXECUTIVE""",AMIN MIGRATION LLP,Ahmedabad,1 - 5 Years
Service Desk Knowledge Manager - J48409,SAMPOORNA CONSULTANTS PVT LTD,Chennai,8 - 12 Years
Machine Learning + Python + Azure - AM -BLR - J48114,SAMPOORNA CONSULTANTS PVT LTD,Bengaluru / Bangalore,7 - 10 Years
Power Platform Lead - J48436,SAMPOORNA CONSULTANTS PVT LTD,Hyderabad/Secunderabad,8 - 10 Years
IVR Developer,Advance Consultancy Services,Other City(s) in Saudi Arabia,6 - 11 Years
PHP Developer Required In GERMANY,PRIMEX IMMIGRATION LLP,Germany,5 - 10 Years
Power Platform -Consultant-BLR - J47539A,SAMPOORNA CONSULTANTS PVT LTD,Bengaluru / Bangalore,4 - 7 Years
Accountant to work in Andheri East Office,SUDHEENDRA AND COMPANY LLP,Mumbai,2 - 7 Years
Snap Logic Developer,SKYWALK VISA IMMIGRATION SERVICES LLP,"Australia,  Canada,  Singapore,  null,  null",2 - 7 Years
"""Enterprise Cloud Architect""",SKYWALK VISA IMMIGRATION SERVICES LLP,"Canada,  Singapore,  UK,  null",1 - 6 Years
Safety Officer,Ample Leap Cognition,Pune,5 - 10 Years
"FOUNDRY MANAGER , 8 - 10 Yr , 10 - 12 L , GHAZIABAD",Swastic Enterprises,"Ahmedabad,  Delhi/NCR",10 - 12 Years
Technical Solution Specialist  Sales Engineer - J48416,SAMPOORNA CONSULTANTS PVT LTD,Pune,7 - 12 Years
Graphic Designer - JH - J48349,SAMPOORNA CONSULTANTS PVT LTD,Bengaluru / Bangalore,2 - 4 Years
Data Scientist,SKYWALK VISA IMMIGRATION SERVICES LLP,"Canada,  Germany",2 - 7 Years
Oracle EBS Cloud Apps Technical Architect,LTIMindtree Ltd.,"Ahmedabad,  Bengaluru / Bangalore,  Chennai,  Gurgaon,  Kolkata",12 - 15 Years
SAP PS Consultant,LTIMindtree Ltd.,"Ahmedabad,  Bengaluru / Bangalore,  Chennai,  Delhi,  Hyderabad/Secunderabad",5 - 10 Years
Senior Oracle FUSION SCM  FUNCTIONAL consultants,Hucon Solutions India Pvt ltd,"Ahmedabad,  Bengaluru / Bangalore,  Chennai,  Delhi,  Pune",10 - 15 Years
Director Business Development,Sarosh Karki,"Amreli,  Dharamshala,  Jammu,  Mysoru / Mysore,  Bhopal",10 - 15 Years
Tech Risk and Regulatory compliance - J48393,SAMPOORNA CONSULTANTS PVT LTD,Mumbai,4 - 9 Years
VueJS Tech Lead,Hucon Solutions India Pvt ltd,"Bengaluru / Bangalore,  Pune,  Bhubaneshwar",10 - 15 Years
Cable jointer,Tawakkal Manpower Services,Other City(s) in Saudi Arabia,0 - 3 Years
Hardware Engineer Job  In POLAND,ADAL IMMIGRATIONS LLP,,5 - 10 Years
Network  Engineer Job In MALTA,World wide Immigration Service Llp,,5 - 10 Years
UX | UI Designer Required In  SINGAPORE,EXOTIC EXPERT SOLUTIONS LLP,Singapore,5 - 10 Years
Flutter Internship in Ahmedabad,Maxgen Technologies,"Ahmedabad,  Bhavnagar,  Junagarh,  Rajkot,  Surendranagar",0 - 1 Years
Orthopaedic required for agra,Space COnsultant,Other City(s) in Uttar Pradesh,1 - 6 Years
"""Automation Test Architect""",LTIMindtree Ltd.,"Hyderabad/Secunderabad,  Pune",8 - 12 Years
Bank Manage   Job In UAE,ADAL IMMIGRATIONS LLP,,5 - 10 Years
Sales  &  Marketing Engineer,Sudeep Consultancy,"Pune,  Other City(s) in Maharashtra",0 - 2 Years
"Senior Graphic Designer , Graphic Designer",Suresh Gopalan Acharya,Mumbai,5 - 10 Years
Workday People Analytics Developer,LTIMindtree Ltd.,"Bengaluru / Bangalore,  Delhi/NCR,  Hyderabad/Secunderabad,  Mumbai,  Pune",5 - 8 Years
UX DESIGNER JOB IN SINGAPORE,CLOUD VISA IMMIGRATION LLP,Singapore,3 - 8 Years
Software Engineer  Job In USA,World wide Immigration Service Llp,,5 - 10 Years
Data Modelling Engineer with Azure Databricks Exp Redshift,White Horse Manpower Consultancy P Ltd,Bengaluru / Bangalore,5 - 10 Years
.net Architect - J48506,SAMPOORNA CONSULTANTS PVT LTD,Mumbai,10 - 15 Years
.net Developer - J48514,SAMPOORNA CONSULTANTS PVT LTD,Mumbai,1 - 3 Years
Lead Data Engineer - J48412,SAMPOORNA CONSULTANTS PVT LTD,Chennai,8 - 13 Years
PHP Developer Hiring For GERMANY,PRIMEX IMMIGRATION LLP,Germany,4 - 8 Years
SAP Data Integration,eSkillport HR Services Pvt. Ltd,"Kolkata,  Mumbai",8 - 12 Years
Openings For Virtual Relationship Manager For Bank - Thane,Hy Fly Consultancy,"Hyderabad/Secunderabad,  Mumbai,  Pune,  Navi Mumbai,  Thane",1 - 6 Years
Sales Manager Jobs in Gulf,TALENT VAULT LLP,"Australia,  Canada,  New Zealand,  Singapore",4 - 9 Years
ServiceNow CSM / ITSM Lead - J48395,SAMPOORNA CONSULTANTS PVT LTD,Chennai,10 - 15 Years
Power Platform Consultant - J48437,SAMPOORNA CONSULTANTS PVT LTD,Hyderabad/Secunderabad,4 - 7 Years
Site Merchandising Assistant - J47254A,SAMPOORNA CONSULTANTS PVT LTD,Bengaluru / Bangalore,5 - 8 Years
Website and Digital Marketing Sales Executive,Reliqus,Delhi,0 - 1 Years
Network Engineer Job In MALTA,CLOUD VISA IMMIGRATION LLP,"Canada,  Singapore,  null",3 - 8 Years
Teacher  Job In  SINGAPORE,EXOTIC EXPERT SOLUTIONS LLP,Singapore,4 - 8 Years
"Sales Executive , Senior Sales Executive",GLOBAL SOURCES EXHIBITIONS  EVENTS INDIA PRIVATE LIMITED,Delhi,1 - 6 Years
DFT Engineers,Hucon Solutions India Pvt ltd,"Ahmedabad,  Bengaluru / Bangalore,  Chennai,  Hyderabad/Secunderabad,  Noida/Greater Noida",6 - 11 Years
Specialist - Software Engineering,LTIMindtree Ltd.,Bengaluru / Bangalore,8 - 12 Years
Oracle EDI developer,LTIMindtree Ltd.,"Ahmedabad,  Bengaluru / Bangalore,  Chennai,  Hyderabad/Secunderabad,  Kolkata",5 - 10 Years
SAP FSCM Functional consultant,Hucon Solutions India Pvt ltd,"Ahmedabad,  Bengaluru / Bangalore,  Chennai,  Delhi,  Pune",8 - 13 Years
Senior Network Administrator - J48400,SAMPOORNA CONSULTANTS PVT LTD,Chennai,10 - 15 Years
Java Fullstack  ( UI Heavy )  - J48370,SAMPOORNA CONSULTANTS PVT LTD,Bengaluru / Bangalore,10 - 13 Years
Project Management trainer,Shalom cadd centre,Mumbai,0 - 3 Years
Java Fullstack Developer,Hucon Solutions India Pvt ltd,Bengaluru / Bangalore,4 - 8 Years
EA - Strategy and Special Projects - J48403,SAMPOORNA CONSULTANTS PVT LTD,Mumbai,5 - 10 Years
Finance  &  Accounts manager,Electrobrain modern technologies pvt ltd,"Rajkot,  Surat,  Surendranagar",5 - 10 Years
Lab Technician  Job In USA,World wide Immigration Service Llp,,5 - 10 Years
"International Sales -  , Debt Collection",sharda consultancy Services,"Delhi,  Delhi/NCR,  Gurgaon",1 - 4 Years
Defence channel,LINEUP MANPOWER SOLUTIONS PRIVATE LIMTED,"Bengaluru / Bangalore,  Pune,  Nasik",0 - 1 Years
Psychiatrist,Space COnsultant,Other City(s) in Uttar Pradesh,0 - 3 Years
Academic Counselor,Forgebs Technologies Pvt Ltd.,"Kolkata,  Dibrugarh,  Bhagalpur,  Patna,  Ranchi",0 - 3 Years
ServiceNow CSM / ITSM Developer  ( 115 )  - J48396,SAMPOORNA CONSULTANTS PVT LTD,Chennai,4 - 7 Years
PHP Developer Job In  GERMANY,PRIMEX IMMIGRATION LLP,Germany,5 - 10 Years
Finance  &  Accounts managment,Electrobrain modern technologies pvt ltd,"Mathura,  Meerut,  Moradabad",5 - 10 Years
Safety Advisor Jobs in Canada - Australia - New Zealand - UK,Srv global consultancy Pvt Ltd,"Australia,  Canada,  Germany,  New Zealand,  null",2 - 7 Years
Healthcare Manager Hiring For  Germany,CLOUD VISA IMMIGRATION LLP,"Dubai,  Canada,  Germany",3 - 8 Years
SEO Intern,Reliqus,Delhi,0 - 1 Years
PS  &  PPM Senior Consultant,eSkillport HR Services Pvt. Ltd,"Kolkata,  Mumbai",5 - 9 Years
Data Scientist,SKYWALK VISA IMMIGRATION SERVICES LLP,"Canada,  Germany",2 - 7 Years
Hardware Engineer,SKYWALK VISA IMMIGRATION SERVICES LLP,"Australia,  Canada,  Singapore,  null",2 - 7 Years
Support Analyst – Finance - J48344,SAMPOORNA CONSULTANTS PVT LTD,Chennai,3 - 5 Years
"""Business Development Executive  ( BDE ) """,GLOBAL SOURCES EXHIBITIONS  EVENTS INDIA PRIVATE LIMITED,Delhi,1 - 6 Years
Sr DevOps Engineer - J48354,SAMPOORNA CONSULTANTS PVT LTD,Hyderabad/Secunderabad,6 - 10 Years
FPGA Prototyping TVC Engineers,Hucon Solutions India Pvt ltd,"Ahmedabad,  Bengaluru / Bangalore,  Chennai,  Hyderabad/Secunderabad,  Noida/Greater Noida",6 - 11 Years
Platform Engineering: Azure DevOps Engineer,TALPRO INDIA PRIVATE LIMITED,Bengaluru / Bangalore,5 - 15 Years
Java Developer,Electrobrain modern technologies pvt ltd,"Madurai,  Nagercoil",3 - 8 Years
Hitachi Storage Administration,LTIMindtree Ltd.,"Chennai,  Hyderabad/Secunderabad,  Kolkata,  Mumbai,  Pune",8 - 12 Years
SAP TRM Lead,Hucon Solutions India Pvt ltd,"Ahmedabad,  Bengaluru / Bangalore,  Chennai,  Delhi,  Pune",8 - 13 Years
Network Data Admin - L3 - J48388,SAMPOORNA CONSULTANTS PVT LTD,Chennai,6 - 10 Years
Full-Stack Developer  ( Back-End )  #93 - J48272,SAMPOORNA CONSULTANTS PVT LTD,Chennai,5 - 8 Years
Logistic Manager Job In POLAND,ADAL IMMIGRATIONS LLP,,5 - 10 Years
Dietician  Job In  NEW ZEALAND,World wide Immigration Service Llp,New Zealand,3 - 8 Years
Creative Strategist – Copy,Elixir Integrated Brandcomm Private Limited,"Mumbai,  Pune",4 - 8 Years
Snowflake Developer,Hucon Solutions India Pvt ltd,Bengaluru / Bangalore,4 - 9 Years
Finance  &  Accounts manager,Electrobrain modern technologies pvt ltd,"Palanpur,  Patan,  Porbandar",5 - 10 Years
ServiceNow CSM / ITSM Developer - J48397,SAMPOORNA CONSULTANTS PVT LTD,Chennai,4 - 7 Years
"Senior Backend Developer , Team Lead Software Engineer , Tech Lead",PREDATORS CONSULTING,"Mumbai,  Navi Mumbai",3 - 8 Years
Finance  &  Accounts managment,Electrobrain modern technologies pvt ltd,"Gorakhpur,  Kanpur,  Lucknow",5 - 10 Years
Pediatrician / Neonatologist,Space COnsultant,Other City(s) in Chhattisgarh,0 - 3 Years
SAP Fiori / UI5 Consultant,eSkillport HR Services Pvt. Ltd,"Kolkata,  Mumbai",8 - 10 Years
UX  /  UI Designer Hiring For GERMANY,CLOUD VISA IMMIGRATION LLP,Germany,3 - 8 Years
Senior Cloud Operations Engineer - J48358,SAMPOORNA CONSULTANTS PVT LTD,Chennai,8 - 12 Years
Emulation Engineers,Hucon Solutions India Pvt ltd,"Ahmedabad,  Bengaluru / Bangalore,  Chennai,  Hyderabad/Secunderabad,  Noida/Greater Noida",6 - 11 Years
