Job Title,Company Name,Location,Experience (Years)
Abroad Requirement IT Manager,RECRUITMENT CANADA IMMIGRATION CANADA,"Australia,  Canada",7 - 12 Years
"""IT Sales Executive"" , Business Development Executive",Serviots technology Pvt Ltd,Ahmedabad,2 - 6 Years
Facilities Manager,Sameer namdep Kedari,"Bengaluru / Bangalore,  Sibsagar,  Bhagalpur,  Muzaffarpur,  Patna",4 - 9 Years
SAP Experienced Candidates,TORRENT POWER LIMITED,Ahmedabad,3 - 5 Years
Technician- Electrical Maintenance,Suman kumar,"Delhi,  Gurgaon,  Pune,  Indore,  Bhubaneshwar",5 - 10 Years
React Native Developer,Management And Computer Consultants,Kolkata,1 - 4 Years
Site  Engineer  Job In  AUSTRALIA,World wide Immigration Service Llp,Australia,4 - 8 Years
QA | QC Engineer  Job In CANADA,World wide Immigration Service Llp,Canada,3 - 8 Years
Sr. Sales Engineer /  Sales Manager,Ambetronics Engineers Pvt. Ltd.,Mumbai,10 - 15 Years
MDM Data Analyst,Techno Wise,Pune,2 - 7 Years
Software Engineer Job In  GERMANY,ADAL IMMIGRATIONS LLP,Germany,3 - 8 Years
QA | QC Engineer  Job In AUSTRALIA,World wide Immigration Service Llp,Australia,4 - 8 Years
Network  Engineer Job In AUSTRALIA,World wide Immigration Service Llp,Australia,4 - 8 Years
QA | QC Engineer  Job In NEW ZEALAND,World wide Immigration Service Llp,New Zealand,3 - 8 Years
Hardware  Engineer  Job In ABROAD,World wide Immigration Service Llp,"Canada,  Singapore,  null,  null,  null",2 - 7 Years
Java - Sr. Developer  /  Lead - J48543,SAMPOORNA CONSULTANTS PVT LTD,Mumbai,6 - 11 Years
Software Engineer,FLARIAL SERVICES LLP,"Australia,  Canada,  Germany,  Singapore",3 - 8 Years
Selenium with Java Trainer,TMOKSHA TECHNOLOGIES PRIVATE LIMITED,Pune,3 - 8 Years
"SAP Basis Consultant , Senior SAP Basis Consultant",Techno Wise,Pune,7 - 12 Years
Field Sales  &  Marketing Executive,ABC Brothers Tech I Pvt Ltd,Ahmedabad,1 - 2 Years
Chief Executive Officer  ( CEO ),Sarosh Karki,"Ahmedabad,  Bengaluru / Bangalore,  Chennai,  Kolkata,  Pune",5 - 10 Years
"Orbit Wallet - React ,  MERN Stack ,  Backend Intern roles",ACCIOJOB PRIVATE LIMITED,Bengaluru / Bangalore,0 - 1 Years
AWS Solution Architect Internship in Pune,Maxgen Technologies,"Pune,  Amravati,  Dhule,  Sangli,  Satara",0 - 1 Years
Java Internship in Pune,Maxgen Technologies,"Pune,  Jalgaon,  Kolhapur,  Nagpur,  Solapur",0 - 1 Years
MARKETING EXECUTIVE,SV ELECTRONICS,"Aurangabad,  Nasik",1 - 2 Years
SAP proffessionals,TORRENT POWER LIMITED,Ahmedabad,3 - 5 Years
Business Analyst,Management And Computer Consultants,Kolkata,2 - 4 Years
"""CalibrationEngineer"" , Electrical Control Engineer",PUNYAM ACADEMY PRIVATE LIMITED,Ahmedabad,1 - 5 Years
Software Engineer  Job In NEW ZEALAND,World wide Immigration Service Llp,New Zealand,3 - 8 Years
Java Full Stack Developer - J48544,SAMPOORNA CONSULTANTS PVT LTD,Mumbai,8 - 12 Years
Mern Stack Internship in Ahmedabad,Maxgen Technologies,"Ahmedabad,  Anand,  Gandhinagar,  Mehsana,  Surat",0 - 1 Years
.net Core Developer,Management And Computer Consultants,Kolkata,2 - 6 Years
Executive - SAP BASIS,TORRENT POWER LIMITED,Ahmedabad,3 - 5 Years
Commercial Inventory Associate 42396 GGN - J48545,SAMPOORNA CONSULTANTS PVT LTD,Gurgaon,1 - 3 Years
Data Science Internship in Ahmedabad,Maxgen Technologies,"Ahmedabad,  Bhavnagar,  Junagarh,  Rajkot,  Surendranagar",0 - 1 Years
OVERSEAS JOB - APPLICATION DEVELOPMENT -  INTERNATIONAL LOCATION,RECRUITMENT CANADA IMMIGRATION CANADA,Canada,8 - 13 Years
ABROAD REQUIREMENT - DBA  / ORACAL  / SQL - INTERNATIONAL LOCATION,RECRUITMENT CANADA IMMIGRATION CANADA,"Australia,  Canada,  Other International Location(s)",8 - 13 Years
ABROAD JOB OFFER - CORPORATE SALES - CAN AUS NZ DM UK GULF,RECRUITMENT CANADA IMMIGRATION CANADA,"Australia,  Canada,  Other International Location(s)",8 - 13 Years
Internation Job for Tour  &  Traval - canada Austraia,RECRUITMENT CANADA IMMIGRATION CANADA,"Canada,  Other International Location(s)",10 - 15 Years
REQUIREMENT - HOSPITALITY JOB OFFER  - CANADA AUSTRALIA,RECRUITMENT CANADA IMMIGRATION CANADA,"Canada,  Other International Location(s)",11 - 16 Years
Senior Control System Engineer in Abroad - CAN AUS NZ DN,RECRUITMENT CANADA IMMIGRATION CANADA,"Dubai,  Australia,  Canada,  Hong Kong",8 - 13 Years
Abroad Requiremen - Software Testing     - CANADA  /   AUSTRALIA,RECRUITMENT CANADA IMMIGRATION CANADA,"Other Gulf/Middle East Location(s),  Australia,  Canada",8 - 13 Years
ABROAD REQUIREMENT- SENIOR UI  ENGINEER -CANADA  /  AUSTRALIA,RECRUITMENT CANADA IMMIGRATION CANADA,"Australia,  Canada,  Hong Kong,  New Zealand",8 - 13 Years
Abroad Requirement  /  Software Engineer    ( CANADA  /  AUSTRALIA ),RECRUITMENT CANADA IMMIGRATION CANADA,"Australia,  Canada",8 - 13 Years
Abroad Requiremen - Software Testing     - CANADA  /   AUSTRALIA,RECRUITMENT CANADA IMMIGRATION CANADA,"Other Gulf/Middle East Location(s),  Australia,  Canada",8 - 13 Years
OVERSEAS REQUIREMENT  - SENIOR SOFTWARE DEVELOPER  - CAN AUS UK,RECRUITMENT CANADA IMMIGRATION CANADA,"Dubai,  Australia,  Canada,  Hong Kong,  New Zealand",8 - 13 Years
ABROAD JOB OFFER - BANKING ALL PROFILE - CANADA - AUSTRALIA,RECRUITMENT CANADA IMMIGRATION CANADA,"Canada,  Other International Location(s)",5 - 10 Years
ABROAD  REQUIREMENT - SUPPLY CHAIN – AUSTRALIA  /  CANADA,RECRUITMENT CANADA IMMIGRATION CANADA,"Australia,  Canada",8 - 13 Years
ABROAD JOBS - BUSINESS  &  PROJECT HEAD - CANADA  /  AUSTRALIA,RECRUITMENT CANADA IMMIGRATION CANADA,"Australia,  Canada,  Other International Location(s)",12 - 17 Years
ABROAD JOB REQUIREMENT - WINDOW ADMIN - CANADA  /  AUSTRALIA,RECRUITMENT CANADA IMMIGRATION CANADA,"Dubai,  Australia,  Canada,  Hong Kong,  New Zealand",12 - 17 Years
"""Lead Python Developer""",Sparks To Ideas,Ahmedabad,0 - 2 Years
Software Developer  ( .net Developer ),Ambetronics Engineers Pvt. Ltd.,Mumbai,1 - 3 Years
"IT Auditor , IT Audit",Next Step Associates,Mumbai,5 - 9 Years
IT Manager,HUE SERVICE PRIVATE LIMITED,"Kolkata,  Guwahati,  Patna,  Ranchi,  Bhubaneshwar",5 - 10 Years
IT sales,Hiring Plus,"Mumbai,  Navi Mumbai,  Thane",1 - 2 Years
IT Recruiter,SKYWALK VISA IMMIGRATION SERVICES LLP,,2 - 7 Years
IT Manager,Sunil,"Mauritius,  New Zealand,  Thailand,  null,  null",2 - 7 Years
IT Manager,Sunil,"Turkey,  Bangladesh,  Indonesia,  Malaysia,  Maldives",2 - 7 Years
IT Manager,Sunil,"Dubai,  Fujairah,  Ras Al Khaimah,  Sharjah,  Um Al Qaiwan",2 - 7 Years
IT Manager,Sunil,"Eastern Province,  Jeddah,  Abu Dhabi,  Al Ain,  Ajman",2 - 7 Years
IT Manager,Sunil,"Kuwait City,  Beirut,  Muscat,  Doha,  Al Madina Al Munawarah",2 - 7 Years
IT Recruiter,SKYWALK VISA IMMIGRATION SERVICES LLP,,2 - 7 Years
IT Manager,Sunil,"Kolkata,  Malda,  Midnapur,  Raniganj,  Siliguri",2 - 7 Years
IT Manager,Sunil,"Asansol,  Burdwan,  Durgapur,  Haldia,  Kharagpur",2 - 7 Years
IT Manager,Sunil,"Haldwani,  Haridwar,  Nainital,  Roorkee,  Rudrapur",2 - 7 Years
IT Manager,Sunil,"Muzaffarnagar,  Noida/Greater Noida,  Saharanpur,  Varanasi / Banaras,  Dehradun",2 - 7 Years
IT Manager,Sunil,"Kanpur,  Lucknow,  Mathura,  Meerut,  Moradabad",2 - 7 Years
IT Manager,Sunil,"Allahabad,  Bareilly,  Faizabad,  Ghaziabad,  Gorakhpur",2 - 7 Years
IT Manager,Sunil,"Tuticorin,  Vellore,  Agartala,  Agra,  Aligarh",2 - 7 Years
IT Manager,Sunil,"Ooty,  Salem,  Thanjavur,  Tirunelveli,  Trichy",2 - 7 Years
IT Manager,Sunil,"Erode,  Hosur,  Kanniyakumari,  Madurai,  Nagercoil",2 - 7 Years
IT Manager,Sunil,"Udaipur,  Gangtok,  Chennai,  Coimbatore,  Cuddalore",2 - 7 Years
IT Manager,Sunil,"Bikaner,  Jaipur,  Jaisalmer,  Jodhpur,  Kota",2 - 7 Years
IT Supervisor,Personnel Selexions - Executive Search,,2 - 7 Years
IT Manager,Sunil,"Patiala,  Ropar,  Sangrur,  Ajmer,  Alwar",2 - 7 Years
IT Manager,Sunil,"Moga,  Mohali,  Muktsar,  Nawanshahr,  Pathankot",2 - 7 Years
IT Manager,Sunil,"Bathinda,  Faridkot,  Fatehgarh Sahib,  Ferozepur,  Gurdaspur",2 - 7 Years
IT Manager,Sunil,"Paradeep,  Puri,  Rourkela,  Amritsar,  Batala",2 - 7 Years
IT Manager,Sunil,"Hoshiarpur,  Jalandhar,  Kapurthala,  Ludhiana,  Mansa",2 - 7 Years
IT Manager,Sunil,"Aizawal,  Dimapur,  Kohima,  Bhubaneshwar,  Cuttack",2 - 7 Years
IT Manager,Sunil,"Vasai,  Virar,  Yavatmal,  Imphal,  Shillong",2 - 7 Years
IT Manager,Sunil,"Aurangabad,  Bhiwandi,  Bhusawal,  Buldhana,  Chandrapur",2 - 7 Years
IT Manager,Sunil,"Pune,  Sangli,  Satara,  Solapur,  Thane",2 - 7 Years
IT Manager,Sunil,"Mumbai,  Nagpur,  Nanded,  Nasik,  Navi Mumbai",2 - 7 Years
IT Manager,Sunil,"Kalyan,  Kolhapur,  Latur,  Lonavala,  Mahabaleshwar",2 - 7 Years
IT Manager,Sunil,"Dhule,  Dombivali,  Gondia,  Hinganghat,  Jalgaon",2 - 7 Years
IT Manager,Sunil,"Indore,  Jabalpur,  Katni,  Ratlam,  Sagar",2 - 7 Years
IT Manager,Sunil,"Palakkad,  Thiruvananthapuram,  Thrissur,  Bhopal,  Gwalior",2 - 7 Years
IT Manager,Sunil,"Jammu,  Kargil,  Kathua,  Kupwara,  Leh",2 - 7 Years
IT Manager,Sunil,"Kaithal,  Karnal,  Kurukshetra,  Mahendergarh,  Narnaul",2 - 7 Years
IT Manager,Sunil,"Gulbarga,  Hubli,  Kolar,  Mangalore,  Mysoru / Mysore",2 - 7 Years
IT Manager,Sunil,"Bellary,  Bengaluru / Bangalore,  Bidar,  Davanagere,  Dharwad",2 - 7 Years
IT Manager,Sunil,"Calicut/ Kozhikode,  Cochin/ Kochi/ Ernakulam,  Kannur,  Kollam,  Kottayam",2 - 7 Years
IT Manager,Sunil,"Bokaro,  Dhanbad,  Jamshedpur,  Ranchi,  Belgaum",2 - 7 Years
IT Manager,Sunil,"Panchkula,  Panipat,  Rewari,  Rohtak,  Sirsa",2 - 7 Years
IT Manager,Sunil,"Poonch,  Pulwama,  Rajouri,  Srinagar,  Udhampur",2 - 7 Years
IT Manager,Sunil,"Dalhousie,  Dharamshala,  Hamirpur,  Kangra,  Kasauli",2 - 7 Years
IT Manager,Sunil,"Una,  Anantnag,  Baramulla,  Budgam,  Doda",2 - 7 Years
IT Manager,Sunil,"Nalagarh,  Parwanoo,  Shimla,  Sirmaur,  Solan",2 - 7 Years
IT Manager,Sunil,"Kinnaur,  Kullu,  Lahaul & Spiti,  Manali,  Mandi",2 - 7 Years
IT Manager,Sunil,"Fatehabad,  Gurgaon,  Hissar,  Jhajjar,  Jind",2 - 7 Years
IT Manager,Sunil,"Sonepat,  Yamunanagar,  Baddi,  Bilaspur,  Chamba",2 - 7 Years
IT Manager,Sunil,"Wankaner,  Ambala,  Bhiwani,  Chandigarh,  Faridabad",2 - 7 Years
IT Manager,Sunil,"Surat,  Surendranagar,  Vadodara,  Valsad -Vapi,  Veraval",2 - 7 Years
IT Manager,Sunil,"Navsari,  Palanpur,  Patan,  Porbandar,  Rajkot",2 - 7 Years
IT Manager,Sunil,"Kalol,  Kandla,  Mehsana,  Morbi,  Nadiad",2 - 7 Years
IT Manager,Sunil,"Satna,  Ujjain,  Ahmednagar,  Akola,  Amravati",2 - 7 Years
IT Manager,Sunil,"Godhra,  Gondal,  Jamnagar,  Jetpur,  Junagarh",2 - 7 Years
IT Manager,Sunil,"Muzaffarpur,  Patna,  Bhilai-Durg,  Bilaspur,  Raipur",2 - 7 Years
IT Manager,Sunil,"Dahod,  Deesa,  Gandhidham,  Gandhinagar,  Gir",2 - 7 Years
IT Manager,Sunil,"Ankleshwar,  Bharuch,  Bhavnagar,  Bhuj,  Botad",2 - 7 Years
IT Manager,Sunil,"Panjim/Panaji,  Vasco Da Gama,  Ahmedabad,  Amreli,  Anand",2 - 7 Years
IT Manager,Sunil,"Nizamabad,  Ongole,  Rajahmundry,  Sangareddy,  Srikakulam",2 - 7 Years
IT Manager,Sunil,"Bongaigaon,  Dhubri,  Dibrugarh,  Guwahati,  Jorhat",2 - 7 Years
IT Manager,Sunil,"Tirupati,  Vijayawada,  Visakhapatnam,  Warangal,  Itanagar",2 - 7 Years
IT Manager,Sunil,"Adilabad,  Anantapur,  Chittoor,  Cuddapah,  Guntakal",2 - 7 Years
IT Manager,Sunil,"Kurnool,  Mahabubnagar,  Medak,  Nalgonda,  Nellore",2 - 7 Years
IT Manager,Sunil,"Guntur,  Hyderabad/Secunderabad,  Kakinada,  Karimnagar,  Khammam",2 - 7 Years
IT Executive,Electrobrain modern technologies pvt ltd,"Delhi,  Delhi/NCR,  Gurgaon,  Noida/Greater Noida,  Pune",3 - 8 Years
IT Manager,Sunil,"Sibsagar,  Silchar,  Tezpur,  Tinsukia,  Bhagalpur",2 - 7 Years
IT Engineer,Anshi Immigration Private Limited,Canada,4 - 9 Years
Director Sales IT,One World,Bengaluru / Bangalore,8 - 13 Years
Business Development Manager - IT System Integrator,Suhail Nizamuddin shaikh,"Hyderabad/Secunderabad,  Kolkata,  Mumbai,  Noida/Greater Noida,  Pune",5 - 10 Years
Senior US IT Recuiter - J48498,SAMPOORNA CONSULTANTS PVT LTD,Hyderabad/Secunderabad,5 - 10 Years
IT Recruiter Job In AUSTRALIA,ADAL IMMIGRATIONS LLP,Australia,3 - 8 Years
Technical Recruiter - J48371,SAMPOORNA CONSULTANTS PVT LTD,Chennai,8 - 12 Years
IT Recruiter Job  In GERMANY,ADAL IMMIGRATIONS LLP,Germany,5 - 10 Years
IT Project Manager,Advance Consultancy Services,Other City(s) in Saudi Arabia,2 - 7 Years
IT Recruiter Job  In USA,ADAL IMMIGRATIONS LLP,,8 - 13 Years
IT Recruiter Job In MALTA,ADAL IMMIGRATIONS LLP,,3 - 8 Years
IT - Sales Execuitve,Whitekraaft Solutions LLP,"Bengaluru / Bangalore,  Hyderabad/Secunderabad,  Pune",5 - 9 Years
IT Recruiter Job In  USA,ADAL IMMIGRATIONS LLP,,5 - 10 Years
IT Recruiter Required In UAE,ADAL IMMIGRATIONS LLP,,7 - 12 Years
IT architecture immigrate to Canada,World Overseas immigration Consultancy Pvt Ltd,"Australia,  Canada",2 - 7 Years
IT Delivery Managers,KALINDI IMMIGRATION CONSULTANTS PRIVATE LIMITED,"Australia,  Canada,  Singapore,  UK,  null",1 - 6 Years
IT-PMO - J48513,SAMPOORNA CONSULTANTS PVT LTD,Mumbai,2 - 4 Years
IT Support Engineer,Victory Educational Consultants,"Los Angeles,  Chicago,  Washington DC,  Detroit,  Newark",6 - 11 Years
IT-PMO - J48513,SAMPOORNA CONSULTANTS PVT LTD,Mumbai,2 - 4 Years
IT Software Engineer,SKYWALK VISA IMMIGRATION SERVICES LLP,"Australia,  Canada,  New Zealand,  Singapore,  null",1 - 6 Years
IT Engineer Job In USA,CLOUD VISA IMMIGRATION LLP,"Canada,  null",3 - 8 Years
IT Project Managers,Navyah Immigration Services Private Limited,"Australia,  Canada,  null,  null,  null",2 - 5 Years
IT Project Manager,Professional HR Solutions,"Ahmedabad,  Bengaluru / Bangalore,  Chennai,  Delhi/NCR,  Kolkata",5 - 10 Years
Urgent Hiring For IT Analyst,Rahul jatav,"Calicut/ Kozhikode,  Cochin/ Kochi/ Ernakulam,  Kottayam,  Thiruvananthapuram,  Thrissur",0 - 3 Years
IT Support Engineer,Viraj Infotech,Mumbai,1 - 2 Years
Urgent Hiring For IT Analyst,Rahul jatav,"Bengaluru / Bangalore,  Dharwad,  Gulbarga,  Hubli,  Mangalore",0 - 3 Years
IT project Internship,Sparks To Ideas,Ahmedabad,0 - 1 Years
IT project Internship,Sparks To Ideas,Ahmedabad,0 - 1 Years
Urgent Hiring For IT Analyst,Rahul jatav,"Mumbai,  Pune,  Aurangabad,  Nagpur,  Solapur",0 - 3 Years
IT Recruiter Job  In NEW ZEALAND,ADAL IMMIGRATIONS LLP,New Zealand,3 - 8 Years
"""Area Sales Executive  /  Manager""",HUE SERVICE PRIVATE LIMITED,"Kolkata,  Guwahati,  Patna,  Raipur,  Ranchi",4 - 9 Years
IT  Software Engineer Job In MALTA,PRIMEX IMMIGRATION LLP,,4 - 8 Years
IT Sales Manager – Government Tender,HUE SERVICE PRIVATE LIMITED,"Kolkata,  Patna,  Other City(s) in Jharkhand,  Bhubaneshwar",5 - 10 Years
IT  Software Engineer Job In CANADA,PRIMEX IMMIGRATION LLP,Canada,3 - 8 Years
IT  Software Engineer Job In GERMANY,PRIMEX IMMIGRATION LLP,Germany,5 - 10 Years
Senior Technical Support Expert  /  International Customer Support,White Horse Manpower Consultancy P Ltd,Bengaluru / Bangalore,1 - 6 Years
Senior Director - Talent Acquisition,One World,"Gurgaon,  Hyderabad/Secunderabad,  Pune",20 - 25 Years
IT  Software Engineer Job In DUBAI,PRIMEX IMMIGRATION LLP,Dubai,3 - 8 Years
Fresher - Technical Support  /  Voice  /  Bpo  /  2022 Passed out,White Horse Manpower Consultancy P Ltd,Bengaluru / Bangalore,0 - 3 Years
IT Recruiters For IT Companies in White Horse Manpower BLR,White Horse Manpower Consultancy P Ltd,Bengaluru / Bangalore,1 - 5 Years
"""Urgent Job opening Software Engineer In Canada""",Anshi Immigration Private Limited,Canada,4 - 9 Years
HR Recruiter,TALENTPULL AND INFRASTRUCTURE PRIVATE LIMITED,Mohali,1 - 4 Years
IT  Software Engineer Required In  NEW ZEALAND,PRIMEX IMMIGRATION LLP,New Zealand,4 - 8 Years
SAP   Fresher walk  @ Valen IT,Valen IT Solutions,"Hyderabad/Secunderabad,  Vijayawada,  Visakhapatnam",0 - 3 Years
MBA Fresher walk in  @ Valen IT,Valen IT Solutions,"Hyderabad/Secunderabad,  Vijayawada,  Visakhapatnam",0 - 3 Years
Remote Jobs In IT For Golang DevOps GCP Engineer,White Horse Manpower Consultancy P Ltd,Bengaluru / Bangalore,4 - 9 Years
IT Manager Jobs in Canada  /  Australia  /  New Zealand,Srv global consultancy Pvt Ltd,"Australia,  Canada,  New Zealand",3 - 8 Years
US ITRecruiter,Maven Workforce Pvt. Ltd.,Noida/Greater Noida,5 - 10 Years
SAP Consultant,Times Business Solution,"Mumbai,  Navi Mumbai,  Thane",3 - 8 Years
"""HR Recruitment Executive""",Pragmatic Solution,Delhi,0 - 2 Years
Software Engineer Jobs in Germany,TALENT VAULT LLP,"Australia,  Canada,  New Zealand,  Singapore",3 - 8 Years
AWS with DataBricks exp in Spark / Pyspark Bangalore IT company,White Horse Manpower Consultancy P Ltd,Bengaluru / Bangalore,4 - 9 Years
"IT Jobs in CCNA Networking ,  Facets ,  JavaJava Full stack ,  Node JS",White Horse Manpower Consultancy P Ltd,"Bengaluru / Bangalore,  Chennai,  Hyderabad/Secunderabad",3 - 8 Years
Business Development Manager,Suhail Nizamuddin shaikh,"Ahmedabad,  Bengaluru / Bangalore,  Chennai,  Delhi,  Delhi/NCR",5 - 10 Years
"IT HELP Desk Pune ,  Bangalore HYD Kolkata 6.2lks",White Horse Manpower Consultancy P Ltd,"Bengaluru / Bangalore,  Hyderabad/Secunderabad,  Kolkata",1 - 3 Years
Fresh Graduates for Technical Support  Voice  IT Help desk  CCNA,White Horse Manpower Consultancy P Ltd,Bengaluru / Bangalore,1 - 5 Years
"IT Recruiter  , HR Exicutive , HR manager",New Global Technologies,"Ahmedabad,  Chennai,  Gurgaon,  Kolkata,  Noida/Greater Noida",0 - 3 Years
Business development executive,Career Job Solution,"Delhi,  Noida/Greater Noida,  Ghaziabad",3 - 8 Years
Digital marketing sales,Career Job Solution,"Delhi,  Noida/Greater Noida,  Ghaziabad",3 - 8 Years
Business Development Management,Career Job Solution,"Delhi,  Noida/Greater Noida,  Ghaziabad",3 - 8 Years
Freelance Recruiters for BPO Hiring WFH,sharda consultancy Services,"Delhi/NCR,  Gurgaon,  Noida/Greater Noida",1 - 5 Years
Sales Development Representative,DANUSH SYSTEMS AND SOLUTIONS,Bengaluru / Bangalore,2 - 4 Years
Recruiter  Job In USA,World wide Immigration Service Llp,,5 - 10 Years
Business Development Officers,Navyah Immigration Services Private Limited,"Dubai,  Australia,  Canada,  Singapore,  null",2 - 5 Years
"HR Manager , Hr Executive",AppSoft Solutions,"Bengaluru / Bangalore,  Chennai,  Delhi,  Mumbai,  Pune",0 - 3 Years
"Jobs In IT Sector Oracle Apps EBS-SCM Python ,  React Sapabap / HANA",White Horse Manpower Consultancy P Ltd,"Bengaluru / Bangalore,  Chennai,  Hyderabad/Secunderabad",3 - 8 Years
IT Procurement,HR Jobs Placements,"Ahmedabad,  Bengaluru / Bangalore,  Chennai,  Delhi,  Gurgaon",5 - 10 Years
"Accounts Manager , Account Manager , Senior Account Manager",MDD Medical Systems India Pvt Ltd,"Gurgaon,  Faridabad",6 - 11 Years
"IT Jobs in Service  SAP TM PM PP ,  Oracle Apps ,  Pune  Hyderabad",White Horse Manpower Consultancy P Ltd,"Bengaluru / Bangalore,  Hyderabad/Secunderabad,  Pune",3 - 8 Years
Data Administrator,Rahul jatav,"Calicut/ Kozhikode,  Cochin/ Kochi/ Ernakulam,  Palakkad,  Thiruvananthapuram,  Thrissur",0 - 3 Years
Google Technical Support Executive troubleshooting Voice  Jobs,White Horse Manpower Consultancy P Ltd,"Bengaluru / Bangalore,  Hyderabad/Secunderabad,  Pune",1 - 6 Years
ServiceDesk Voice Support  Active Directory Exp  ticketingtools,White Horse Manpower Consultancy P Ltd,Bengaluru / Bangalore,1 - 5 Years
Technical Recruiter | Ludhiana,LifeInsuranceJobs . in,Ludhiana,0 - 3 Years
HR Exectuvie,Whitekraaft Solutions LLP,Hyderabad/Secunderabad,0 - 1 Years
Recruitment Officer | Ludhiana,LifeInsuranceJobs . in,Ludhiana,0 - 3 Years
Director Student placements,SNJ Skye Management Consultant,Kanpur,10 - 15 Years
HR Executive- Talent Acquisition | Ludhiana,LifeInsuranceJobs . in,Ludhiana,0 - 3 Years
HR Executive- Talent Acquisition | Ludhiana,LifeInsuranceJobs . in,Ludhiana,0 - 3 Years
Manager Corporate Relation Placements Engineering College,SNJ Skye Management Consultant,Kanpur,2 - 7 Years
Business Development Manager,MOBILE COMMUNICATIONS INDIA PRIVATE LIMITED,"Delhi,  Delhi/NCR,  Gurgaon,  Noida/Greater Noida",2 - 7 Years
Enterprise Architect Manager,Ample Leap Cognition,Faridabad,8 - 13 Years
Technical Recruiter | Ludhiana,LifeInsuranceJobs . in,Ludhiana,0 - 3 Years
Recruitment Officer | Ludhiana,LifeInsuranceJobs . in,Ludhiana,0 - 3 Years
Canada # Engineer Manager,Anshi Immigration Private Limited,Canada,4 - 9 Years
HR Executive | Ludhiana,LifeInsuranceJobs . in,Ludhiana,0 - 3 Years
"""Business Development Executive  ( BDE ) """,Multi fold IT Solutions private limited,"Ambala,  Faridabad,  Karnal,  Panipat,  Yamunanagar",1 - 2 Years
HR Executive- Talent Acquisition | Ludhiana,LifeInsuranceJobs . in,Ludhiana,0 - 3 Years
IT Procurement,HR Jobs Placements,"Hyderabad/Secunderabad,  Kolkata,  Mumbai,  Noida/Greater Noida,  Pune",5 - 10 Years
Jobs for Aircraft Maintenance at Airport,Akash A,"Bengaluru / Bangalore,  Hyderabad/Secunderabad,  Vijayawada,  Ahmedabad,  Gulbarga",0 - 3 Years
HR Coordinator,M.gheewala Global HR Consultants,Dubai,3 - 8 Years
"""Full Stack Java Developer""",SHREE ADISHAKTHI CONSULTANCY,"Bengaluru / Bangalore,  Chennai,  Mumbai,  Pune",5 - 10 Years
Senior Human Resources Consultant,M.gheewala Global HR Consultants,"Chennai,  Delhi,  Mumbai",8 - 13 Years
Cyber Security Analyst jobs in Canada - Australia - Singapore,Srv global consultancy Pvt Ltd,"Australia,  Canada",2 - 7 Years
"B.E  , B.tech  , Diploma engineer-fresher / trainee",New Global Technologies,"Ahmedabad,  Delhi/NCR,  Gurgaon,  Kolkata,  Noida/Greater Noida",0 - 3 Years
IT Applications Analyst / Developer,Laxmi Infotech,"Ahmedabad,  Gurgaon,  Noida/Greater Noida,  Chandigarh,  Bhubaneshwar",0 - 3 Years
"B.E  , B.tech  , Diploma- engineers",New Global Technologies,"Bengaluru / Bangalore,  Chennai,  Delhi/NCR,  Hyderabad/Secunderabad,  Pune",0 - 3 Years
"L1 , l2 Support Engineer",Laxmi Infotech,"Mumbai,  Pune",0 - 3 Years
Freshers - B.E - CSE  /  IT  &  MCA Graduates,Laxmi Infotech,"Ahmedabad,  Delhi,  Gurgaon,  Kolkata,  Noida/Greater Noida",0 - 3 Years
IT Operations Management,HR Jobs Placements,"Hyderabad/Secunderabad,  Kolkata,  Mumbai,  Noida/Greater Noida,  Pune",6 - 11 Years
"IT Developer , web developer",Laxmi Infotech,"Ahmedabad,  Delhi/NCR,  Gurgaon,  Kolkata,  Noida/Greater Noida",0 - 3 Years
Marketing Executive,Multi fold IT Solutions private limited,"Amritsar,  Bathinda,  Jalandhar,  Kapurthala,  Ludhiana",1 - 3 Years
Field Sales Representative,Multi fold IT Solutions private limited,"Faridabad,  Panipat,  Chandigarh,  Jalandhar,  Pathankot",0 - 2 Years
Ticketing Ushering F & B Executive in Multiplex Theater Jeedimetla,Hungry Bird IT Consulting Services Pvt Ltd,Hyderabad/Secunderabad,0 - 3 Years
Receptionist  walk in,Valen IT Solutions,"Hyderabad/Secunderabad,  Vijayawada",1 - 3 Years
Relationship Officer,STAR CAREER CONSULTANT,"Delhi,  Delhi/NCR,  Gurgaon,  Noida/Greater Noida",2 - 6 Years
Oracle Cloud Finance Functional Consultant,Best Infosystems Ltd.,Hyderabad/Secunderabad,6 - 11 Years
Finance Analyst,Ample Leap Cognition,Panipat,3 - 8 Years
"System Administrator , Server Engineer , Firewall",IT Mantra Techintellect  Private Limited,Kolkata,6 - 11 Years
Quality Control Executive,CHEMIX SPECIALITY GASES AND EQUIPMENT,Bengaluru / Bangalore,1 - 3 Years
Network  Engineer  Job In NEW ZEALAND,World wide Immigration Service Llp,New Zealand,3 - 8 Years
React js Internship in Pune,Maxgen Technologies,"Pune,  Jalgaon,  Kolhapur,  Nagpur,  Solapur",0 - 1 Years
Laptop Service  /  Repair Engineer,Communications test design india private limited,Bengaluru / Bangalore,1 - 5 Years
Java - Sr. Developer  /  Lead - J48539,SAMPOORNA CONSULTANTS PVT LTD,Mumbai,6 - 11 Years
Textile Maintaince manager,Kausar Textile Private Limited,Other City(s) in Maharashtra,15 - 20 Years
SailPoint Identity Now Developer,LTIMindtree Ltd.,"Bengaluru / Bangalore,  Chennai,  Hyderabad/Secunderabad,  Mumbai,  Pune",5 - 8 Years
Life Insurance Advisor - High Earning Potential,sreepada visweshwara Rao,Hyderabad/Secunderabad,1 - 6 Years
Bank Manage  Job In  GERMANY,ADAL IMMIGRATIONS LLP,Germany,4 - 8 Years
OPERATION HEAD / HEAD OF OPERATION  ( Male ),RGRA HUMAN RESOURCE SOLUTIONS,"Delhi,  Noida/Greater Noida",10 - 15 Years
Administrator,KALINDI IMMIGRATION CONSULTANTS PRIVATE LIMITED,"Australia,  Canada,  Germany,  Singapore,  null",1 - 6 Years
NETWORKING SENIOR TECHNICIAN,Pama International,Doha,2 - 5 Years
Programmatic L35- Chennai - J48538,SAMPOORNA CONSULTANTS PVT LTD,Chennai,5 - 8 Years
Hardware Engineer Job In GERMANY,ADAL IMMIGRATIONS LLP,Germany,4 - 8 Years
GM MEP PROJECTS,Suman kumar,"Ahmedabad,  Bengaluru / Bangalore,  Hyderabad/Secunderabad,  Kolkata,  Lucknow",20 - 25 Years
Website Designer,SKYWALK VISA IMMIGRATION SERVICES LLP,"Australia,  New Zealand,  Singapore,  null",3 - 8 Years
Seo executive,sharda consultancy Services,"Delhi,  Gurgaon",1 - 2 Years
Inside Sale Representative,Peopleplease Consulting,Mumbai,0 - 3 Years
System Software Analyst Jobs in Canada - Australia,Srv global consultancy Pvt Ltd,"Australia,  Canada",2 - 7 Years
sales executive,Informatics Technologies Pvt. Ltd.,Vadodara,1 - 4 Years
Accountant,ENIGMASOFT TECHNOLOGIES PRIVATE LIMITED,Panjim/Panaji,4 - 7 Years
MALE BUSY OPERATOR / MALE ACCOUNTANT  ( BUSY Accounting Software ) ​,RGRA HUMAN RESOURCE SOLUTIONS,Delhi,0 - 3 Years
"""Asset Management""",Communications test design india private limited,Bengaluru / Bangalore,3 - 5 Years
Oracle HCM Payroll Functional Role,Best Infosystems Ltd.,Hyderabad/Secunderabad,6 - 11 Years
Payments Operations UK Banking Immediate joining B'lore KPOs,White Horse Manpower Consultancy P Ltd,Bengaluru / Bangalore,2 - 7 Years
"Data Engineer  Python Programming  SOLR  SQL Server , MongoDB ,  ETL",White Horse Manpower Consultancy P Ltd,Bengaluru / Bangalore,5 - 10 Years
Data Science Internship in Pune,Maxgen Technologies,"Pune,  Amravati,  Dhule,  Sangli,  Satara",0 - 1 Years
Marketing Specialist – POS ( Point of Sale )  - J48534,SAMPOORNA CONSULTANTS PVT LTD,Pune,2 - 4 Years
