Job Title,Company Name,Location,Experience (Years)
Sr.Operation Executive /  IT Recruiter,CONNECTING 2 WORK,Thiruvananthapuram,0 - 3 Years
Senior Engineer IT Infrastructure  (  81548375  ),Reliance Jio Infocomm Limited,Mumbai,7 - 12 Years
Senior Engineer IT Infrastructure  (  81530911  ),Reliance Jio Infocomm Limited,Mumbai,7 - 12 Years
Manager  IT QA  &  CSV,rxlogix corporation,Noida/Greater Noida,10 - 14 Years
IT Helpdesk  &  Security Manager,recooty,Thailand,1 - 2 Years
IT Security Analyst  ( Japanese Speaker ),DXC Technologies,Malaysia,0 - 1 Years
IT Infrastructure  &  Cloud Engineer,International Information Technology Team,,0 - 3 Years
Sr. Project Manager  IT Applications,Gati Ltd,Hyderabad/Secunderabad,2 - 3 Years
IT Sales Executive  ( Inside Sales ),Exioms,"Hyderabad/Secunderabad,  Mumbai,  Chennai,  Pune,  Bengaluru / Bangalore",0 - 3 Years
Powershell Engineer  /  IT Automation Engineer,nexthink solutions,"Switzerland,  Boston",5 - 9 Years
"Session: IT Marketing ,  Software Marketing",DIGITAL DREAMS,Allahabad,0 - 2 Years
"IT Financial Analyst ,  Cadency and OneStream",Bombardier Inc.,Canada,5 - 8 Years
Principal Associate - IT - Solarwind Administrator,eurofins it solutions pvt ltd,Bengaluru / Bangalore,5 - 8 Years
Principal Associate-IT - Network Admin,eurofins it solutions pvt ltd,Bengaluru / Bangalore,5 - 8 Years
IT Business Implementation Analyst 4,ORACLE,"Mexico,  Bengaluru / Bangalore,  Hyderabad/Secunderabad",6 - 10 Years
IT Compliance Specialist - SOX Audits,ORACLE,,6 - 10 Years
Apigee-IT Customer Service Representative,accenture,Bengaluru / Bangalore,2 - 5 Years
"IT Engineer ,  End User Support",Nvidia Graphics Pvt Ltd,Redmond,5 - 8 Years
BBL /  IT Service Desk Medewerker,volvo group india pvt ltd,Netherlands,0 - 1 Years
Title: Team Member - SAP IT,sun pharma industries ltd panoli ( dist-bharuch ),Mumbai,1 - 4 Years
IT Service Management  (  AM / TL ),Information Services Group,Bengaluru / Bangalore,8 - 11 Years
Sales lead - IT Software Solution,SEVEN CONSULTANCY,Bengaluru / Bangalore,3 - 7 Years
Sales Executive Reputed IT Industry,SEVEN CONSULTANCY,"Navi Mumbai,  Mumbai,  Pune",0 - 2 Years
IT Project Coordinator / Business Analyst,IndiaInternets,Noida/Greater Noida,0 - 1 Years
Sales Executive Reputed IT Industry,SEVEN CONSULTANCY,"Mumbai,  Pune",0 - 2 Years
IT Analyst Job Details | Corning,Corning,Gurgaon,5 - 8 Years
Principal Associate-IT- Backup Engineer,eurofins it solutions pvt ltd,Bengaluru / Bangalore,7 - 10 Years
Senior Associate -IT  ( Intune Engineer ),eurofins it solutions pvt ltd,Bengaluru / Bangalore,6 - 9 Years
Technical Lead - IT  ( Sr.network architect ),eurofins it solutions pvt ltd,Bengaluru / Bangalore,10 - 13 Years
"IT Appl Analyst ,  FinTech-Treasury",AMAZON INDIA PVT LTD,Hyderabad/Secunderabad,5 - 8 Years
Technical Lead - IT  ( ETL Engineer ),eurofins it solutions pvt ltd,"Chennai,  Bengaluru / Bangalore",6 - 9 Years
Business Development Executive  ( IT Sales ),Essence Software Solutions Pvt. Ltd.,Gurgaon,2 - 5 Years
IT Sales Manager  ( Product Sales ),Essence Software Solutions Pvt. Ltd.,Gurgaon,5 - 8 Years
CHIEF MANAGER  IT BUSINESS PARTNER,infinity business solutions pvt ltd,Mumbai,12 - 15 Years
ROLE: P & L Head - IT Vertical,TransGraph Consulting Pvt.Ltd.,Hyderabad/Secunderabad,15 - 18 Years
ROLE: Business Analyst - Functional IT,TransGraph Consulting Pvt.Ltd.,Hyderabad/Secunderabad,4 - 7 Years
IT Sales or Business Development Manager,tokyotechie,"Germany,  Singapore",5 - 10 Years
IT Infrastructure and Technical Support Engineer,targray india pvt ltd,Canada,7 - 9 Years
IT Engineer Education - Min HSC,MEP Infrastructure Developers Limited,Mumbai,1 - 4 Years
Careers:Senior IT Project Manager,Lucini & Lucini Communications,Bengaluru / Bangalore,10 - 13 Years
Content Writer  ( web and IT service ),ADEEBA E SERVICES PVT LTD,Noida/Greater Noida,0 - 2 Years
IT Admin / Lead  ( Linux and AWS ),corelynx solutions private limited,,5 - 8 Years
Sales Executive  /  Manager IT Products,CONNECTING 2 WORK,Thiruvananthapuram,1 - 4 Years
US IT Recruiter   ( US Shift ),CONNECTING 2 WORK,Thiruvananthapuram,2 - 5 Years
"IT Support Engineer I ,  OTS",AMAZON INDIA PVT LTD,Bengaluru / Bangalore,1 - 9 Years
Google AdWords Specialist for IT Agency,cart geek,"Mumbai,  Sagar",2 - 3 Years
Business Development Executive / Analyst - IT,LINUXBEAN SOLUTION PVT LTD,Indore,0 - 3 Years
Business Development Executive / Analyst - IT,LINUXBEAN SOLUTION PVT LTD,Indore,0 - 3 Years
Business Development Executive / Analyst - IT,LINUXBEAN SOLUTION PVT LTD,Indore,0 - 3 Years
Business Development Executive / Analyst - IT,LINUXBEAN SOLUTION PVT LTD,Indore,0 - 3 Years
Business Development Executive / Analyst - IT,LINUXBEAN SOLUTION PVT LTD,Indore,0 - 3 Years
IT Manager DataMgmt SQL Server,LINKTAG,Pune,4 - 7 Years
IT Project Manager F / M,CGI Information Systems and Management Consultants Pvt Ltd,Italy,5 - 7 Years
HRBM  ( Financial Services  &  IT ),cnh industrial india pvt ltd,Gurgaon,7 - 10 Years
Powershell Engineer  /  IT Automation Engineer,nexthink solutions,"Switzerland,  Boston",5 - 8 Years
Junior Engineer IT Infrastructure  (  81450656  ),Reliance Jio Infocomm Limited,Mumbai,2 - 6 Years
IT  /  Data Science Content Writer,EDUCBA,Mumbai,1 - 4 Years
IT Sales  &  Marketing Professionals,aimsoft solutions,Thiruvananthapuram,2 - 4 Years
IT Projektleiter  ( m / w / d ),CGI Information Systems and Management Consultants Pvt Ltd,Germany,3 - 5 Years
IN_RBAI_Senior Engineer-Production IT Support,Bosch Ltd,Bengaluru / Bangalore,2 - 5 Years
Opening For Freshers for IT Executive for Ludhiana,TandA HR Solutions,Ludhiana,0 - 3 Years
Opening for System Admin in IT industry,TandA HR Solutions,Panchkula,1 - 3 Years
Hiring for System Admin in IT Industry,TandA HR Solutions,Panchkula,1 - 3 Years
Digital Marketing | IT Sales Manager,EPPEOK SOLUTIONS PRIVATE LIMITED,Kolkata,3 - 5 Years
"IT Manager Remote ,  Remote - Mexico",Pinkerton Consulting & Investigations Inc.,Mexico,4 - 5 Years
Sr.seO Hiring For IT Company In Noida,ADEEBA E SERVICES PVT LTD,Noida/Greater Noida,0 - 3 Years
Technical Content Writer For IT Company,ADEEBA E SERVICES PVT LTD,Noida/Greater Noida,0 - 3 Years
Technical content writer For IT Company,ADEEBA E SERVICES PVT LTD,Noida/Greater Noida,0 - 3 Years
IT company In Noida looking for SEO,ADEEBA E SERVICES PVT LTD,Noida/Greater Noida,0 - 3 Years
IT Technical Project Management Office,yokogawa electric corp ltd- saudi arabia,Bengaluru / Bangalore,6 - 9 Years
ION Group - Senior IT Auditor,ion trading india pvt. ltd.,Pune,5 - 8 Years
IT Engineer - Customer Support Services,solution enterprises pvt ltd  ( ncr corporation india pvt ltd ),Mumbai,3 - 6 Years
Business Analyst IT F / H,CGI Information Systems and Management Consultants Pvt Ltd,France,5 - 8 Years
Looking forBusinessdevelopmentexecutivefor an IT Industry in Mohalilocation,TandA HR Solutions,"Delhi,  Noida/Greater Noida,  Mohali",0 - 5 Years
Looking forPHPDeveloper for an IT companyin Panchkulalocation,TandA HR Solutions,Panchkula,2 - 5 Years
Opening for theSalesExecutiveprofile for an IT Company forBangalorelocation,TandA HR Solutions,Bengaluru / Bangalore,0 - 5 Years
Job Opening forWordPressDeveloperfor an IT companyinMohalilocation,TandA HR Solutions,Mohali,1 - 3 Years
Hiring forReactNativeDeveloperfor a IT company in Bangalore,TandA HR Solutions,Bengaluru / Bangalore,0 - 5 Years
Urgent hiring for ContentWriterfor an IT companyinMohalilocation,TandA HR Solutions,Mohali,2 - 4 Years
Vacancy for IT Technician for Bangalore location,TandA HR Solutions,Bengaluru / Bangalore,3 - 4 Years
Hiring for Receptionist in Mohali for IT Company,TandA HR Solutions,Mohali,2 - 5 Years
Hiring forASP.netDeveloperfor an IT companyin Gurugramlocation,TandA HR Solutions,Gurgaon,4 - 7 Years
Looking forPHPDeveloperfor an IT companyin Panchkulalocation,TandA HR Solutions,Panchkula,2 - 5 Years
Hiring for theITsalesexecutivesprofile for IT company forBangaloreLocation.,TandA HR Solutions,Bengaluru / Bangalore,3 - 5 Years
Required QualityAnalystfor an IT company in MohaliLocation,TandA HR Solutions,Mohali,0 - 1 Years
Urgent hiring for Angular Developer for IT,TandA HR Solutions,"Bengaluru / Bangalore,  Mohali",1 - 3 Years
Hiring forASP.netDeveloperfor an IT companyin Gurugramlocation,TandA HR Solutions,Gurgaon,4 - 7 Years
Hiring for theSalesExecutiveprofile for an IT company forBangalorelocation.,TandA HR Solutions,Bengaluru / Bangalore,1 - 2 Years
Resiliency Consultant  IT Disaster Recovery,Optum Global Solutions  ( India )  Private Limited,Philippines,8 - 11 Years
"IT Support Engineer I ,  OTS",AMAZON INDIA PVT LTD,Pune,1 - 8 Years
IT Trainee  /  Prcticas en Informtica,Hilton Hotels & Resorts,Spain,0 - 1 Years
Regional IT Program Manager  ( AI ),Microsoft India Pvt Ltd,Australia,5 - 9 Years
Manager IT Audit Risk Assurance,wsne consulting,Delhi,0 - 3 Years
IT Architects  /  Sr. Technology Managers,Mapps IT Services Pvt Ltd,Kolkata,10 - 15 Years
SAP IT Business Systems Analyst,Intel Technology India Pvt Ltd,Bengaluru / Bangalore,8 - 11 Years
Consulting IT - Business Analyst / PMO,DXC Technologies,Italy,3 - 6 Years
Industry Technical Sales Specialist  ( ITS ),Intel Technology India Pvt Ltd,Dubai,5 - 8 Years
Senior Data Engineer  ( IT )  - Database,Merilytics,Hyderabad/Secunderabad,2 - 5 Years
Senior Data Engineer  ( IT )  - Database,MERITUS INTELYTICS PRIVATE LIMITED,Hyderabad/Secunderabad,2 - 5 Years
General Manager,HR Jobs Placements,"Ahmedabad,  Bengaluru / Bangalore,  Delhi/NCR,  Hyderabad/Secunderabad,  Pune",14 - 19 Years
"Director ,  Head of IT Infrastructure - Altera",Intel Technology India Pvt Ltd,Bengaluru / Bangalore,8 - 15 Years
Senior IT Infrastructure Support Engineer,CGI Information Systems and Management Consultants Pvt Ltd,Australia,5 - 10 Years
US IT / Non-ITRecruiter  &  Senior US IT / Non-IT Recruiter,ProAssert,"Chennai,  Coimbatore,  Trichy,  Bengaluru / Bangalore",0 - 3 Years
"Software Developer , lead",New Global Technologies,"Bengaluru / Bangalore,  Chennai,  Hyderabad/Secunderabad,  Mumbai,  Pune",0 - 3 Years
Project  &  Program Manager,HR Jobs Placements,"Delhi/NCR,  Hyderabad/Secunderabad,  Kolkata,  Mumbai,  Pune",11 - 16 Years
java full stalk developer,Laxmi Infotech,"Bengaluru / Bangalore,  Chennai,  Hyderabad/Secunderabad,  Noida/Greater Noida,  Pune",0 - 3 Years
Project Manager,HR Jobs Placements,"Bengaluru / Bangalore,  Chennai,  Delhi/NCR,  Hyderabad/Secunderabad,  Pune",8 - 13 Years
Senior Consultant-Information Security Architect,Aujas Networks Pvt Ltd,Mumbai,4 - 8 Years
Software Sales Executive,SEVEN CONSULTANCY,Kohima,2 - 4 Years
Salesforce Service Cloud Developer,SEVEN CONSULTANCY,Chennai,5 - 8 Years
Senior Manager,SEVEN CONSULTANCY,"Delhi,  Delhi/NCR",3 - 6 Years
Operation Executive,SEVEN CONSULTANCY,Chennai,6 - 9 Years
Security Engineer,vault infosec,Chennai,2 - 3 Years
ICT Business  &  Systems Analysts,silverlink technilogies,Australia,0 - 3 Years
Sales Manager  /  Solutions Architect -  ( Corporate  &  Govt Projects ),Indo Asia Global Technologies Private Limited,"Hyderabad/Secunderabad,  Mumbai,  Delhi,  Delhi/NCR",2 - 8 Years
Software Sales Executive,cyberindigo net private limited,Pune,0 - 3 Years
Business Development Executive,Application Square Infotech Pvt Ltd,Nasik,0 - 3 Years
Hr. Recruiter  /  Recruitment Specialist,apex jobs,Gurgaon,0 - 3 Years
Team Lead,ace softex pvt. ltd.,Rajkot,1 - 4 Years
Business Analayst,CONNECTING 2 WORK,Cochin/ Kochi/ Ernakulam,2 - 5 Years
Data Centre Engineer,sp sysnet pte. lte.,Mumbai,0 - 2 Years
URGENT OPENING FOR US IT RECRUITER IN MOHALI LOCATION,TandA HR Solutions,Mohali,0 - 1 Years
Production IT Engineer Job Details | ZF Group,zf india pvt ltd,Chennai,3 - 5 Years
IT-Skerhetsarkitekt till kund inom offentlig sektor.,CGI Information Systems and Management Consultants Pvt Ltd,Sweden,5 - 8 Years
Specialist - IT Security GRC Job Details | LANXESS,lanxess pvt ltd,Thane,5 - 10 Years
System Engineer - IT SecOps Job Details | Barco,barco india,"Belgium,  Noida/Greater Noida",6 - 9 Years
IT Security Experte  ( m / w / d ),CGI Information Systems and Management Consultants Pvt Ltd,Germany,3 - 7 Years
"Senior Manager - IT Operations ,  Service Delivery ,  DevOps",infinity business solutions pvt ltd,Pune,10 - 15 Years
IT Project Consultant Job Details | SAP,SAP Ariba,Pune,4 - 8 Years
IT Project Developer - BTP Job Details | SAP,SAP Ariba,Bengaluru / Bangalore,5 - 7 Years
"Director ,  IT Product  &  Service Management",netskope software pvt.ltd,"Bengaluru / Bangalore,  Australia",1 - 4 Years
IT Technology Services Specialist Job Details | SAP,SAP Ariba,Bengaluru / Bangalore,8 - 11 Years
Senior Storage Operations Engineer  ( Senior IT Engineer ),LAKSH HUMAN RESOURCE,Noida/Greater Noida,5 - 8 Years
Sourcing Executive - US IT Recruitment  ( Night Shift ),Einstro,Chennai,2 - 5 Years
IT Technology Project Manager Job Details | SAP,SAP Ariba,Bengaluru / Bangalore,3 - 6 Years
IT Project Senior Consultant Job Details | SAP,SAP Ariba,Bengaluru / Bangalore,8 - 12 Years
Assistant IT Manager - Sheraton Hai Phong,Marriott International Inc,,2 - 5 Years
IT Support Service Desk- Senior Analyst,OakNorth Bank,Gurgaon,5 - 8 Years
Sr Analyst Audit  &  Compliance  ( IT ),DXC Technologies,Mumbai,4 - 7 Years
ServiceNow IT Service Management-Application Designer,accenture,Bengaluru / Bangalore,3 - 5 Years
GM - Zone IT Business Relationship Manager,Schneider Electric Pvt Ltd,Bengaluru / Bangalore,10 - 13 Years
Senior IT Architect Job Details | Boston Scientific,BOSTON SCIENTIFIC,,10 - 13 Years
IT Architect Job Details | Boston Scientific,BOSTON SCIENTIFIC,,5 - 8 Years
Onsite IT Support Technician  ( m / f / d ),DXC Technologies,Germany,2 - 5 Years
IT Project Senior Consultant Job Details | SAP,SAP Ariba,Pune,5 - 8 Years
"IT QA Engineer ,  Principal  ( Copado  &  Salesforce )",PROGRESS SOFTWARE,Hyderabad/Secunderabad,6 - 9 Years
Position Title  Senior Executive  IT procurement,e-stone information technology,Mumbai,3 - 7 Years
"Sr Lead ,  Cyber Sec IT RiskM",northern trust corp ltd - london,Pune,5 - 10 Years
IT Internship Job Details | Boston Scientific,BOSTON SCIENTIFIC,,0 - 1 Years
IT Project Manager Job Details | Boston Scientific,BOSTON SCIENTIFIC,Gurgaon,8 - 12 Years
Inside Sales Representative-Reputed IT industry,SEVEN CONSULTANCY,Thane,0 - 3 Years
Jobs for fresher customer support executive-IT,SEVEN CONSULTANCY,"Navi Mumbai,  Mumbai,  Thane",0 - 2 Years
Job for TL Sales with Reputed IT Company,SEVEN CONSULTANCY,Mumbai,3 - 5 Years
Project Manager ( IT Team  &  Developers ),SEVEN CONSULTANCY,"Navi Mumbai,  Mumbai",10 - 15 Years
B.Tech   MBA Fresher || IT Sales || Noida,ebizon net info  ( p )  ltd,Noida/Greater Noida,0 - 2 Years
IT Network Specialist Job Details | singlebuoy,SBM OFFSHORE,,5 - 8 Years
IT Architecture Expert Job Details | SAP,SAP Ariba,Bengaluru / Bangalore,10 - 13 Years
Delivery Manager - Manufacturing Domain - IT Services,Flex-i Partners,Chicago,10 - 15 Years
Vice President - IT Infra - Mumbai  ( Goregaon East ),kotak mahindra bank,Mumbai,5 - 8 Years
Web Designer | Top IT Company In Gurgaon | AHOM,AHOM Technologies Private Limited,Gurgaon,1 - 3 Years
IT Service Management Administrator  &  Developer,SYNCTON IT Solutions,Hyderabad/Secunderabad,3 - 10 Years
IT Technology Services Specialist Job Details | SAP,SAP Ariba,Bengaluru / Bangalore,3 - 9 Years
IT Specialist  ( SharePoint Online  &  Office 365 ),Marketone International,Bengaluru / Bangalore,7 - 10 Years
"Regional Manager - Sales  (  IT Products ,  Services )",infinity business solutions pvt ltd,Delhi/NCR,13 - 18 Years
"Technical Consultant  /  Architect - Enterprise Monitoring ,  IT Infrastructure",infinity business solutions pvt ltd,Gurgaon,10 - 14 Years
ION Group - Senior Business Consultant  ITS,ion trading india pvt. ltd.,,5 - 10 Years
ION Group - Senior Technical Consultant  IT2,ion trading india pvt. ltd.,Pune,5 - 8 Years
ION Group - Senior Business Consultant  IT2,ion trading india pvt. ltd.,Pune,3 - 7 Years
Sales Process - IT Solutions  ( Outbound Process ),jtg infotech services pvt. ltd,Delhi,0 - 2 Years
Manager - IT Job Details | Kalpataru Group,jmc projects  ( india )  ltd,Mumbai,8 - 15 Years
IT Service Delivery Manager | Intuitor Softech Services,intuitor softtech services pvt. ltd.,Bengaluru / Bangalore,5 - 10 Years
IT Asset Manager | Intuitor Softech Services,intuitor softtech services pvt. ltd.,Bengaluru / Bangalore,2 - 8 Years
JD- IT Sales  &  Business Development,Cloud18 Infotech Pvt Ltd,Lucknow,0 - 3 Years
POSITION IT Software Application programming  &  Maintenance,cdl it pvt ltd,Vadodara,3 - 6 Years
Business Development Manager - IT Sales Beamstacks,BeamStacks,Gurgaon,3 - 6 Years
Member IT  ( Off-role ) - Paints Manufacturing- Ludhiana,ADITYA BIRLA MANAGEMENT CORPORATION LTD,Ludhiana,2 - 4 Years
IT Infrastructure Manager  ( Web / Cloud / Security ),2Soft Solutions Pvt. Ltd.,Mumbai,5 - 8 Years
Sales Manager for IT Service based company in Mumbai,2Soft Solutions Pvt. Ltd.,Mumbai,6 - 12 Years
Principal Associate - IT  (  Senior Cloud Engineer  ),eurofins it solutions pvt ltd,Bengaluru / Bangalore,7 - 10 Years
"Senior Program Manager ,  IT Process and Standardization",Microsoft India Pvt Ltd,"Redmond,  Atlanta",4 - 6 Years
LinkedIn Marketing For IT Augmentation  Lead Generation Specialist,cart geek,"Mumbai,  Sagar",2 - 5 Years
Urgent Opening For - IT Business Analyst - Sourcedesk Global,Sourcedesk Global Private Limited,Kolkata,3 - 7 Years
Business Development Executive / Business Analyst-IT,LINUXBEAN SOLUTION PVT LTD,Indore,0 - 3 Years
Business Development Executive - IT Online Bidder,LINUXBEAN SOLUTION PVT LTD,Indore,0 - 3 Years
Business Analyst  (  BE  (  Elec )  or MBA )  for IT Company,LINUXBEAN SOLUTION PVT LTD,Indore,0 - 3 Years
IT Business Analyst  (  BE  (  Elec )  or MBA ),LINUXBEAN SOLUTION PVT LTD,Indore,0 - 3 Years
IT Business Analyst  (  BE  (  Elec )  or MBA ),LINUXBEAN SOLUTION PVT LTD,Indore,0 - 3 Years
IT Business Analyst  (  BE  (  Elec )  or MBA ),LINUXBEAN SOLUTION PVT LTD,Indore,0 - 3 Years
SAP ABAP - Contract with Renowed IT Firm,LINKTAG,Bengaluru / Bangalore,3 - 5 Years
Junior IT Projektmanager  ( m / w / d ),CGI Information Systems and Management Consultants Pvt Ltd,Germany,1 - 3 Years
Senior IT Analyst Job Details | ZF Group,zf india pvt ltd,Chennai,5 - 10 Years
IT Project Senior Consultant Job Details | SAP,SAP Ariba,"Germany,  Mexico,  Bengaluru / Bangalore",7 - 10 Years
IT Security Specialist ( Security-EndPoint protection ),NTT Data Vertex Software Inc.,Mexico,3 - 5 Years
Principal IT Analyst Job Details | ZF Group,zf friedrichshafen -itc,Chennai,5 - 10 Years
Business Systems Analyst- IT SAP GTS,Intel Technology India Pvt Ltd,,2 - 5 Years
Staff IT Product Manager - Microsoft Solutions,Infoblox,Seattle,5 - 12 Years
IT Architect Banking  ( m / f / d ),CGI Information Systems and Management Consultants Pvt Ltd,Germany,5 - 10 Years
IT End User Support Manager  /  Team Leader,enflexis solutions pvt ltd pune,Japan,2 - 10 Years
IT- Project Coordinator  ( 6 Months to 2 Years ),DREAMSOL TELESOLUTIONS PVT. LTD.,"Delhi,  Delhi/NCR,  Noida/Greater Noida",0 - 2 Years
IT- Project Coordinator  ( 6 Months to 2 Years ),DREAMSOL TELESOLUTIONS PVT. LTD.,"Delhi,  Delhi/NCR,  Noida/Greater Noida",0 - 2 Years
Bench Sales- Executive /  Manager  ( US IT Staffing ),Advaya Infotech Pvt Ltd,Noida/Greater Noida,1 - 3 Years
Business Development Executive /  Manager  ( US IT Staffing ),Advaya Infotech Pvt Ltd,Noida/Greater Noida,0 - 3 Years
Microsoft Word - Senior_IT_Recruiter - senior-it-recruiter,ERP Analysts  ( INDIA )  Pvt. Ltd.,Hyderabad/Secunderabad,5 - 7 Years
Field Tech Senior Associate - Onsite IT Support,NTT Data Vertex Software Inc.,Australia,3 - 5 Years
IT Engineer  ( For JV in Chennai )  Job Details | Corning,Corning,Chennai,3 - 5 Years
"IT Audit Manager ,  Defensive Secuirty Team",AMAZON INDIA PVT LTD,Bengaluru / Bangalore,5 - 10 Years
IT Solutions Section Leader  &  Director,eurofins it solutions pvt ltd,"Germany,  null,  France,  null",1 - 4 Years
Systemadministrator  /  IT - Administrator  Energiewirtschaft  ( m / w / d ),CGI Information Systems and Management Consultants Pvt Ltd,Germany,1 - 5 Years
Hiring of SEO position for Mohali for IT Company,TandA HR Solutions,Mohali,2 - 4 Years
Hiring of -iOS Developer for Raipur for IT Company,TandA HR Solutions,Raipur,2 - 4 Years
Opening of Project Manager for Mohali for IT Company,TandA HR Solutions,Mohali,2 - 5 Years
Sr. Client Acquisition  US / UK IT Staffing,TandA HR Solutions,Hyderabad/Secunderabad,3 - 8 Years
Urgent openings for Online Bidders  ( BDE )  for IT Company,TandA HR Solutions,Panchkula,0 - 2 Years
Job Opening of PPC Executive for Mohali for IT Company,TandA HR Solutions,Mohali,2 - 3 Years
Vacancy of Manager  ( Service Support )  for Panchkula for IT Company,TandA HR Solutions,Panchkula,2 - 5 Years
Hiring of Service Engineer for Panchkula for IT Company,TandA HR Solutions,"Shimla,  Karnal,  Jalandhar,  Delhi,  Panchkula",1 - 2 Years
Opening of Service Coordinator for Panchkula for IT Company,TandA HR Solutions,Panchkula,2 - 3 Years
Looking for Sales Coordinator for Panchkula for IT Company,TandA HR Solutions,Panchkula,1 - 2 Years
Post vacant for US IT recruiters in Hyderabad in Malakpet,TandA HR Solutions,Hyderabad/Secunderabad,2 - 4 Years
Business Development Executive fro IT Company in Hyderabad,TandA HR Solutions,Hyderabad/Secunderabad,0 - 2 Years
Hiring for Full Stack Developer in IT Park Chandigarh,TandA HR Solutions,Chandigarh,3 - 5 Years
Hiring for Full Stack Developer in IT Park Chandigarh,TandA HR Solutions,Chandigarh,2 - 7 Years
Opening for the ios developer in Mohali Location for IT Company,TandA HR Solutions,Mohali,1 - 3 Years
Sr Hr Executive for IT Company in Mohali,TandA HR Solutions,Mohali,3 - 5 Years
Java Developer for IT Park Chandigarh Location In MNC,TandA HR Solutions,Chandigarh,6 - 10 Years
Hiring for SEO Analyst for IT Company  Mohali  ( Punjab ),TandA HR Solutions,Mohali,1 - 2 Years
Job Opening for System Admin in IT Company  Mohali,TandA HR Solutions,Mohali,2 - 5 Years
Job Opening for System Admin in IT Company  Panchkula,TandA HR Solutions,"Panchkula,  Mohali",2 - 5 Years
Urgent opening for Online Bidder for IT Company,TandA HR Solutions,Chandigarh,1 - 4 Years
Urgent opening for Asp.net Profile for IT Company in Mohali,TandA HR Solutions,Mohali,0 - 1 Years
Urgent opening for Online Bidder profile for IT Company,TandA HR Solutions,Ludhiana,1 - 4 Years
Urgent opening for Multimedia Designer for IT company in Panchkula,TandA HR Solutions,Panchkula,2 - 5 Years
Urgent opening for Online Bidder for IT Company in Mohali,TandA HR Solutions,Mohali,0 - 2 Years
Urgently Required PHP Developer in An IT Company in Mohali,TandA HR Solutions,"Chandigarh,  Mohali",1 - 3 Years
Opening for HR  &  Admin in IT Company,TandA HR Solutions,Mohali,1 - 4 Years
Job Opening for Tele Caller in Mohali in IT Industry,TandA HR Solutions,Mohali,1 - 4 Years
Urgent Opening for Asp.net Profile for IT Company,TandA HR Solutions,Mohali,0 - 1 Years
Urgent Opening for Tech Lead for IT Company,TandA HR Solutions,Mohali,10 - 13 Years
URGENT OPENING FOR IT CONSULTANT IN MNC IN PANCHKULA LOCATION,TandA HR Solutions,Panchkula,0 - 1 Years
Urgent Opening for Business Development Manager in IT Company,TandA HR Solutions,Mohali,0 - 1 Years
Urgent Opening for Blockchain Engineer in IT Company in Mohali,TandA HR Solutions,Mohali,3 - 6 Years
Job Opening for Networking Administrator in IT Park Chandigarh,TandA HR Solutions,Chandigarh,1 - 4 Years
Opening for Data Analyst for IT Company in Mohali,TandA HR Solutions,Mohali,2 - 5 Years
Opening for SQL DBA in IT Company for Mohali Location,TandA HR Solutions,Mohali,5 - 8 Years
Opening for System Administrator in IT Company for Mohali location,TandA HR Solutions,Mohali,5 - 10 Years
Opening for Dot Net Developer in IT Park Mohali,TandA HR Solutions,Mohali,2 - 5 Years
Opening for Dot Net Developer in Chandigarh IT Park,TandA HR Solutions,Chandigarh,1 - 3 Years
Opening for Full Stack Developer in Chandigarh IT Park,TandA HR Solutions,Chandigarh,4 - 6 Years
Opening for Quality Analyst in Chandigarh IT Park Location,TandA HR Solutions,Chandigarh,5 - 8 Years
Opening for PL / SQL Developer in Mohali IT Park,TandA HR Solutions,Mohali,4 - 10 Years
Opening for PHP Developer in IT Company for Mohali Location,TandA HR Solutions,Mohali,1 - 3 Years
Opening for ROR Developer in IT Company for Mohali Location,TandA HR Solutions,Mohali,1 - 4 Years
Leading IT Company Looking For Content Writer,ADEEBA E SERVICES PVT LTD,Noida/Greater Noida,0 - 3 Years
Jr / Sr. SEO Executive For IT company in Noida,ADEEBA E SERVICES PVT LTD,Noida/Greater Noida,0 - 3 Years
Job Opening for Web Developer  IT Park Chandigarh,TandA HR Solutions,Chandigarh,1 - 3 Years
Job Opening for PHP Programmer  IT Park Chandigarh,TandA HR Solutions,Chandigarh,1 - 3 Years
Job Opening for PHP Developer  IT Park Chandigarh,TandA HR Solutions,Chandigarh,1 - 3 Years
IT-Security Management Consultant  ( m / f / d ),CGI Information Systems and Management Consultants Pvt Ltd,Germany,3 - 5 Years
Lalamove - Office IT Support  ( Part-time ),Lalamove,Hong Kong,0 - 3 Years
"Managing Director ,  IT Global Professional Services",fedexex,"Pittsburgh,  Dallas",10 - 15 Years
Principal Associate IT - Senior Network Engineer,eurofins it solutions pvt ltd,Bengaluru / Bangalore,8 - 9 Years
"IT APP Dev Engineer ,  Financial Planning",AMAZON INDIA PVT LTD,Bengaluru / Bangalore,3 - 5 Years
IT-arkitekt till kund inom offentlig sektor,CGI Information Systems and Management Consultants Pvt Ltd,Sweden,5 - 10 Years
Hiring for Data Analystfor a IT companyinChandigarh location,TandA HR Solutions,Chandigarh,0 - 2 Years
