Job Title,Company Name,Location,Experience (Years)
Customer Service Executive - Mutual Fund Co Payrolll,Hy Fly Consultancy,"Mumbai,  Pune,  Navi Mumbai,  Thane",0 - 3 Years
Senior .net Backend  /  Full Stack Developers,TALPRO INDIA PRIVATE LIMITED,Bengaluru / Bangalore,5 - 15 Years
"social media executive , video editor",Orbex Technologies Private Limited,"Delhi,  Delhi/NCR,  Gurgaon",0 - 3 Years
Junior .net Developer,TALPRO INDIA PRIVATE LIMITED,Bengaluru / Bangalore,5 - 15 Years
Hardware Engineer  Job In  SINGAPORE,ADAL IMMIGRATIONS LLP,Singapore,5 - 10 Years
Computer Science Engineer jobs in Canada - Australia,Srv global consultancy Pvt Ltd,"Australia,  Canada",2 - 7 Years
Remote - Senior CNC Implementation Consultant,TALPRO INDIA PRIVATE LIMITED,Bengaluru / Bangalore,7 - 15 Years
QA / QC Engineer Job In USA,CLOUD VISA IMMIGRATION LLP,,3 - 8 Years
"Finance ,  Accounts  &  Costing",Electrobrain modern technologies pvt ltd,"Chennai,  Delhi,  Delhi/NCR,  Gurgaon,  Noida/Greater Noida",5 - 10 Years
Accountant,SKYWALK VISA IMMIGRATION SERVICES LLP,"Australia,  Canada,  Singapore,  null,  null",2 - 7 Years
MANAGER – PLANNING  &  BILLING,Suman kumar,"Ahmedabad,  Bengaluru / Bangalore,  Chennai,  Delhi,  Hyderabad/Secunderabad",8 - 10 Years
"Software Engineer , SEO Specialist",GigKafe.LLC Brand VLearnNow,"Ahmedabad,  Bengaluru / Bangalore,  Delhi/NCR,  Kolkata",5 - 10 Years
Node Js Internship in Ahmedabad,Maxgen Technologies,"Ahmedabad,  Anand,  Gandhinagar,  Mehsana,  Surat",0 - 1 Years
Sales Manager | Cluster Manager,LINEUP MANPOWER SOLUTIONS PRIVATE LIMTED,"Kolkata,  Bhubaneshwar,  Cuttack,  Asansol,  Durgapur",1 - 3 Years
B.tech Project Internship,Sparks To Ideas,"Ahmedabad,  Anand,  Bhavnagar,  Gandhinagar,  Junagarh",0 - 1 Years
.net Developer - J48514,SAMPOORNA CONSULTANTS PVT LTD,Mumbai,1 - 3 Years
Remote - Azure DevOps Engineer,TALPRO INDIA PRIVATE LIMITED,Bengaluru / Bangalore,5 - 15 Years
Java Backend Developer  ( 39041 )  - J48405,SAMPOORNA CONSULTANTS PVT LTD,Bengaluru / Bangalore,4 - 7 Years
Cyber Security Training In Ahmedabad,Sparks To Ideas,"Ahmedabad,  Bhavnagar,  Botad,  Junagarh,  Rajkot",0 - 1 Years
PHP Developer Job  In  DUBAI,PRIMEX IMMIGRATION LLP,Dubai,2 - 7 Years
Head System Engineer jobs in Canada - Australia -  Germany,Srv global consultancy Pvt Ltd,"Australia,  Canada",2 - 7 Years
Technology Specialist  /  Architect - J48374,SAMPOORNA CONSULTANTS PVT LTD,"Bengaluru / Bangalore,  Chennai",12 - 17 Years
"HR MANAGER  , 5 - 10 Yr , 30 - 40 K , GHAZIABAD",Swastic Enterprises,"Delhi/NCR,  Noida/Greater Noida",5 - 10 Years
Senior Appian Developer / Lead / Architect,TALPRO INDIA PRIVATE LIMITED,Bengaluru / Bangalore,5 - 15 Years
"PHP Developer , Php Programmer , ""Full Stack PHP Developer""",Peopleplease Consulting,Mumbai,1 - 5 Years
Product Owner,TALPRO INDIA PRIVATE LIMITED,Bengaluru / Bangalore,5 - 15 Years
Systems  &  Finance Accountant,Electrobrain modern technologies pvt ltd,"Delhi,  Delhi/NCR,  Noida/Greater Noida",5 - 10 Years
.net Full Stack Developer,TALPRO INDIA PRIVATE LIMITED,Bengaluru / Bangalore,5 - 15 Years
QA / QC Engineer Jobs in Abroad,TALENT VAULT LLP,"Australia,  Canada,  New Zealand,  Singapore",4 - 9 Years
GRAPHIC DESIGNER  &  VIDEO EDITOR,Options & Ideas,"Kolkata,  Guwahati,  Ranchi,  Siliguri",0 - 3 Years
Network Support Engineer,IT Mantra Techintellect  Private Limited,Bengaluru / Bangalore,4 - 6 Years
Data Integration Engineer,LTIMindtree Ltd.,"Ahmedabad,  Bengaluru / Bangalore,  Chennai,  Delhi,  Hyderabad/Secunderabad",5 - 8 Years
Electrical maintenance engineer,ShivaKumar S,Thailand,2 - 7 Years
MIS Executive,SKYWALK VISA IMMIGRATION SERVICES LLP,"Canada,  null",7 - 12 Years
Python Internshp in Ahmedabad,Maxgen Technologies,"Ahmedabad,  Anand,  Gandhinagar,  Mehsana,  Surat",0 - 1 Years
HR Generalist,Electrobrain modern technologies pvt ltd,"Ahmedabad,  Delhi,  Delhi/NCR,  Gurgaon,  Noida/Greater Noida",3 - 8 Years
QA | QC Engineer  Job In USA,World wide Immigration Service Llp,,5 - 10 Years
Oracle Fusion Data Intelligence Consultant,LTIMindtree Ltd.,"Bengaluru / Bangalore,  Kolkata,  Mumbai,  Noida/Greater Noida,  Pune",3 - 8 Years
"Flutter Developer , Senior Flutter Developer , Tech Lead - Flutter",PREDATORS CONSULTING,"Mumbai,  Navi Mumbai",2 - 7 Years
Solution Architect- Pre Sales - J48415,SAMPOORNA CONSULTANTS PVT LTD,Bengaluru / Bangalore,12 - 17 Years
EUC Operations Manager - J48408,SAMPOORNA CONSULTANTS PVT LTD,Chennai,10 - 15 Years
AWS DevOps Engineer,TALPRO INDIA PRIVATE LIMITED,Bengaluru / Bangalore,5 - 15 Years
Website Designer Hiring For GERMANY,CLOUD VISA IMMIGRATION LLP,"Dubai,  Canada,  Germany",3 - 8 Years
Remote - Senior Oracle Cloud Payroll Functional Consultant,TALPRO INDIA PRIVATE LIMITED,Bengaluru / Bangalore,5 - 15 Years
Finance Accounts Officer,Electrobrain modern technologies pvt ltd,"Gandhinagar,  Jamnagar,  Junagarh,  Palanpur",5 - 10 Years
Oracle SCM Functional Lead,LTIMindtree Ltd.,"Ahmedabad,  Bengaluru / Bangalore,  Chennai,  Hyderabad/Secunderabad,  Kolkata",8 - 12 Years
Oracle Data Intergrator,LTIMindtree Ltd.,Kolkata,3 - 8 Years
Database analysts and  administrators,Navyah Immigration Services Private Limited,"Dubai,  Australia,  Canada,  Singapore,  null",2 - 7 Years
Deputy Manager,Electrobrain modern technologies pvt ltd,"Ahmedabad,  Chennai,  Delhi,  Delhi/NCR,  Gurgaon",5 - 10 Years
Java Backend Developer  ( 36795 ) -Sat Drive - J48406,SAMPOORNA CONSULTANTS PVT LTD,Bengaluru / Bangalore,4 - 7 Years
Website Designer,SKYWALK VISA IMMIGRATION SERVICES LLP,"New York City,  Australia,  Canada,  New Zealand,  Singapore",2 - 7 Years
Senior Quality Assurance 3D Artist - J48227,SAMPOORNA CONSULTANTS PVT LTD,"Bengaluru / Bangalore,  Chennai",6 - 11 Years
Test Architect,LTIMindtree Ltd.,"Chennai,  Kolkata",12 - 16 Years
.netcore Sr. Tech Lead - J48367,SAMPOORNA CONSULTANTS PVT LTD,Bengaluru / Bangalore,10 - 14 Years
Finance  &  Accounts manager,Electrobrain modern technologies pvt ltd,"Delhi,  Delhi/NCR,  Mumbai,  Noida/Greater Noida,  Pune",5 - 10 Years
Obiee Developer,LTIMindtree Ltd.,Kolkata,3 - 8 Years
"""Back end Developer"" , Golang Develoer",PREDATORS CONSULTING,"Mumbai,  Navi Mumbai",1 - 3 Years
MS Dynamics F and O Finance Associate Consultant - J48196,SAMPOORNA CONSULTANTS PVT LTD,Pune,0 - 3 Years
Oracle project accounting functional Consultant,LTIMindtree Ltd.,"Ahmedabad,  Bengaluru / Bangalore,  Chennai,  Hyderabad/Secunderabad,  Kolkata",7 - 12 Years
"Senior Developer , Senior Developer / Software Engineer",PREDATORS CONSULTING,"Mumbai,  Navi Mumbai",3 - 8 Years
Data Science Internship in Ahmedabad,Maxgen Technologies,"Ahmedabad,  Bhavnagar,  Junagarh,  Rajkot,  Surat",0 - 1 Years
IDAM - Transformation Director - J48377,SAMPOORNA CONSULTANTS PVT LTD,Chennai,18 - 23 Years
UI Technical Lead,Hucon Solutions India Pvt ltd,"Bengaluru / Bangalore,  Pune,  Bhubaneshwar",8 - 12 Years
Java Backend Developer  ( 39041 )  - J48405,SAMPOORNA CONSULTANTS PVT LTD,Bengaluru / Bangalore,4 - 7 Years
Java Developer,Electrobrain modern technologies pvt ltd,"Bhopal,  Gwalior,  Indore",3 - 8 Years
SENIOR SOFTWARE ENGINEER,Electrobrain modern technologies pvt ltd,"Delhi,  Delhi/NCR,  Gurgaon,  Mumbai,  Noida/Greater Noida",3 - 8 Years
Data Management Developer- J48282,SAMPOORNA CONSULTANTS PVT LTD,"Bengaluru / Bangalore,  Delhi,  Mumbai",2 - 4 Years
Cloud Operations Manager - J48386,SAMPOORNA CONSULTANTS PVT LTD,Chennai,15 - 20 Years
Java Technical Architect,Hucon Solutions India Pvt ltd,Pune,13 - 18 Years
Java Internship in Pune,Maxgen Technologies,"Pune,  Amravati,  Dhule,  Sangli,  Satara",0 - 1 Years
Sharepoint Developer,LTIMindtree Ltd.,"Bengaluru / Bangalore,  Chennai,  Delhi/NCR,  Hyderabad/Secunderabad,  Mumbai",5 - 10 Years
Job for Data Science in Ahmedabad,Sparks To Ideas,Ahmedabad,0 - 1 Years
Sales and Marketing Manager - Finland  &  Singapore,LIMA FLY PRIVATE LIMITED,"Singapore,  null",7 - 12 Years
Web Designer / Developer,sharda consultancy Services,"Delhi,  Delhi/NCR",3 - 6 Years
"Admin Executive , Administration Assistant / Executive",MIAECT Pvt Ltd,"Mumbai,  Navi Mumbai,  Thane",2 - 5 Years
Internship For Data Science,Sparks To Ideas,Ahmedabad,0 - 1 Years
Java Springboot  ( Req ID: 40675 ) -Level E - J48413,SAMPOORNA CONSULTANTS PVT LTD,Bengaluru / Bangalore,3 - 8 Years
Job for Data Science in Ahmedabad,Sparks To Ideas,Ahmedabad,0 - 1 Years
Team Leader Voice openings,White Horse Manpower Consultancy P Ltd,Bengaluru / Bangalore,1 - 6 Years
Purchase / Material Management,U.S,Mumbai,3 - 8 Years
"Aircraft Mechanical maintenance engineer , Electrical Engineer",sachin kumar,"Ahmedabad,  Bengaluru / Bangalore,  Chennai,  Hyderabad/Secunderabad,  Mumbai",1 - 6 Years
Scrum master and Project manager,Midas Touch,"Bengaluru / Bangalore,  Hyderabad/Secunderabad,  Mumbai,  Pune",7 - 12 Years
QA Automation API  Rest assured  mandate  Cucumber java selenium,White Horse Manpower Consultancy P Ltd,Bengaluru / Bangalore,7 - 12 Years
Data Analyst Internship in Pune,Maxgen Technologies,"Pune,  Amravati,  Dhule,  Sangli,  Satara",0 - 1 Years
"Python Developer , Python , Python Full stack",Peopleplease Consulting,Mumbai,1 - 5 Years
"Fullstake Developer , Senior Software Engineer , Software Engineer",SHREE ADISHAKTHI CONSULTANCY,"Bengaluru / Bangalore,  Chennai",4 - 8 Years
Python Developer - J48497,SAMPOORNA CONSULTANTS PVT LTD,Pune,1 - 4 Years
Senior .net Developer - Back End,TALPRO INDIA PRIVATE LIMITED,Bengaluru / Bangalore,7 - 15 Years
HR cum IR MANAGER,ANIRUDDHA ROY CHOUDHURY,"Chennai,  Gurgaon,  Kolkata,  Mumbai",13 - 18 Years
RPA Developer Process Excellence Mumbai,Client of placement company,Mumbai,2 - 6 Years
Winter Inter in cyber,Sparks To Ideas,Ahmedabad,0 - 1 Years
Senior Consultant For Jira Immediate Joiners,White Horse Manpower Consultancy P Ltd,"Bengaluru / Bangalore,  Chennai,  Pune",12 - 17 Years
Maintenance Manager,Suman kumar,"Chennai,  Delhi/NCR,  Bilaspur,  Satna,  Rourkela",10 - 15 Years
Oracle Flexcube Technical with Corporate core banking,LTIMindtree Ltd.,"Bengaluru / Bangalore,  Chennai,  Hyderabad/Secunderabad,  Mumbai,  Pune",3 - 8 Years
Full Stack Internship in Pune,Maxgen Technologies,"Pune,  Amravati,  Dhule,  Sangli,  Satara",0 - 1 Years
Data science Internship,Sparks To Ideas,Ahmedabad,0 - 1 Years
AWS Solution Architect Internship in Pune,Maxgen Technologies,"Pune,  Jalgaon,  Kolhapur,  Nasik,  Solapur",0 - 1 Years
Cyber security Internship,Sparks To Ideas,Ahmedabad,0 - 1 Years
Hardware Engineer Hiring  For DUBAI,ADAL IMMIGRATIONS LLP,Dubai,13 - 18 Years
"PA to MD , Salary 30-32K , Charges applicable after selection",Spearhead Technology Services,Kolkata,5 - 10 Years
SENIOR ACCOUNTS EXECUTIVE,Suman kumar,"Delhi/NCR,  Kolkata,  Pune,  Jaipur,  Lucknow",8 - 12 Years
Oracle VBCS / VBS Developer,LTIMindtree Ltd.,"Bengaluru / Bangalore,  Chennai,  Delhi/NCR,  Kolkata,  Mumbai",3 - 8 Years
"React JS Developer , ""Full Stack Software Developer""",Peopleplease Consulting,Mumbai,1 - 5 Years
React JS Developer,Waytogo Consultants Pvt Ltd,Pune,3 - 7 Years
SAP Project Manager required in Canada under PR,World Overseas immigration Consultancy Pvt Ltd,"Australia,  Canada",2 - 7 Years
Python Internship in Pune,Maxgen Technologies,"Pune,  Amravati,  Dhule,  Sangli,  Satara",0 - 1 Years
"LWC Developer , Lightning Web Components Developer",One World,"Ahmedabad,  Bengaluru / Bangalore,  Gurgaon,  Hyderabad/Secunderabad,  Mumbai",3 - 8 Years
Software Engineer II - J48455,SAMPOORNA CONSULTANTS PVT LTD,Chennai,2 - 5 Years
Database Administrator,Waytogo Consultants Pvt Ltd,Hyderabad/Secunderabad,2 - 7 Years
Lead Consultant Solutions Designing BPM immediate Joinings,White Horse Manpower Consultancy P Ltd,"Bengaluru / Bangalore,  Chennai,  Pune",12 - 17 Years
"PHP Developer , Php Programmer , Software Engineer",Gaurangna Singh,"Ahmedabad,  Pune,  Bilaspur,  Raipur,  Indore",1 - 6 Years
Computer Network and Systems Engineer,Navyah Immigration Services Private Limited,"Australia,  Canada,  null,  null,  null",2 - 5 Years
Regional Head Business Development,Equniox Business Solutions,Bengaluru / Bangalore,15 - 20 Years
Free internship in React Js,Sparks To Ideas,Ahmedabad,0 - 1 Years
Sap Concur Consultant immediate Joining,White Horse Manpower Consultancy P Ltd,Bengaluru / Bangalore,5 - 8 Years
Free Python Internship In Ahmedabad,Sparks To Ideas,"Ahmedabad,  Bhavnagar,  Botad,  Gandhinagar,  Junagarh",0 - 1 Years
Full Stack Developer  ( c# / .net ),TALPRO INDIA PRIVATE LIMITED,Bengaluru / Bangalore,7 - 15 Years
Winter Internship for cyber security,Sparks To Ideas,Ahmedabad,0 - 1 Years
Data science Internship,Sparks To Ideas,Ahmedabad,0 - 1 Years
Data Analyst - AI / ML - J48458,SAMPOORNA CONSULTANTS PVT LTD,Chennai,3 - 5 Years
Data Analyst Internship in Pune,Maxgen Technologies,"Pune,  Amravati,  Dhule,  Sangli,  Satara",0 - 1 Years
"""DevOps Developer""",Medicca Limited,Bengaluru / Bangalore,3 - 8 Years
Web Designers and Developers,Navyah Immigration Services Private Limited,"Dubai,  Australia,  Canada,  Singapore,  null",2 - 5 Years
Python Developer Internship,Maxgen Technologies,"Ahmedabad,  Anand,  Gandhinagar,  Mehsana,  Surat",0 - 1 Years
Senior Director - Program  &  Project Management,LTIMindtree Ltd.,Hyderabad/Secunderabad,18 - 22 Years
Facility Manager,Suman kumar,"Gurgaon,  Kolkata,  Mumbai,  Chandigarh,  Indore",10 - 15 Years
"Personal Assistant , Secretary",Indica Industries Pvt Ltd,Noida/Greater Noida,3 - 8 Years
React js Internship in Pune,Maxgen Technologies,"Pune,  Jalgaon,  Kolhapur,  Nasik,  Solapur",0 - 1 Years
Power BI Developer,Waytogo Consultants Pvt Ltd,Hyderabad/Secunderabad,3 - 8 Years
Assistant Manager-Packaging Purchase,Venky's India Ltd.,Pune,10 - 15 Years
Java internship in Ahmedabad,Maxgen Technologies,"Ahmedabad,  Bhavnagar,  Junagarh,  Rajkot,  Surendranagar",0 - 1 Years
Aircraft Mechanical maintenance engineer,sachin kumar,"Bengaluru / Bangalore,  Chennai,  Mumbai,  Pune,  Visakhapatnam",1 - 6 Years
"PHP Developer , Web Developer , Software Developer , Software Engineer",DATAMAX INFOTECH,Mumbai,4 - 5 Years
Project Internship,Sparks To Ideas,Ahmedabad,0 - 1 Years
"HR Jobs in Bangalore ,  Immediate Joining ,  DayShift ,  Sal 18k+Inc",White Horse Manpower Consultancy P Ltd,Bengaluru / Bangalore,1 - 4 Years
General Ledger Accountant,EXO Edge,"Delhi/NCR,  Gurgaon,  Noida/Greater Noida,  Chandigarh,  Mohali",4 - 9 Years
Business Analyst - J48343,SAMPOORNA CONSULTANTS PVT LTD,Hyderabad/Secunderabad,2 - 4 Years
"QA Engineer , Software Testing Engineer",Times internetghtytutujhjd,Bongaigaon,2 - 7 Years
Permanent Remote -AWS DevOps Engineer,TALPRO INDIA PRIVATE LIMITED,Bengaluru / Bangalore,7 - 15 Years
Project Internship,Sparks To Ideas,Ahmedabad,0 - 1 Years
Data Science Internship in Pune,Maxgen Technologies,"Pune,  Amravati,  Dhule,  Sangli,  Satara",0 - 1 Years
3D Environmental artist,BLUEPULSE VENTURES PRIVATE LIMITED,"Bengaluru / Bangalore,  Mumbai",2 - 3 Years
B.tech Project Internship,Sparks To Ideas,"Ahmedabad,  Anand,  Bhavnagar,  Gandhinagar,  Junagarh",0 - 1 Years
Sr. Customer support executive Voice - Bank Payroll,Hy Fly Consultancy,"Pune,  Mumbai,  Navi Mumbai,  Thane",0 - 3 Years
"HRBP , Human Resource Business Partner , Human Resource Generalist",PREDATORS CONSULTING,"Mumbai,  Navi Mumbai",5 - 9 Years
"Course Designer , Content creator",Forgebs Technologies Pvt Ltd.,"Bengaluru / Bangalore,  Hyderabad/Secunderabad,  Kolkata,  Mumbai,  Pune",1 - 5 Years
React JS Internship in Pune,Maxgen Technologies,"Pune,  Amravati,  Aurangabad,  Nasik,  Sangli",0 - 1 Years
DevOps Cloud engineer - J48260,SAMPOORNA CONSULTANTS PVT LTD,Hyderabad/Secunderabad,3 - 5 Years
Software and Applications Programmers,Navyah Immigration Services Private Limited,"Dubai,  Australia,  Canada,  Japan,  null",2 - 7 Years
Winter Internship,Sparks To Ideas,Ahmedabad,0 - 1 Years
React Js Internship in Ahmedabad,Maxgen Technologies,"Ahmedabad,  Bhavnagar,  Junagarh,  Rajkot,  Surat",0 - 1 Years
Mern Stack Internship in Ahmedabad,Maxgen Technologies,Ahmedabad,0 - 1 Years
React Js Internship in Ahmedabad,Maxgen Technologies,"Ahmedabad,  Anand,  Gandhinagar,  Mehsana,  Surendranagar",0 - 1 Years
Data Management Developer-R1075025 - J48282,SAMPOORNA CONSULTANTS PVT LTD,"Bengaluru / Bangalore,  Delhi,  Mumbai",2 - 4 Years
"""APPLICATION SUPPORT ENGINEER""",Electrobrain modern technologies pvt ltd,"Bengaluru / Bangalore,  Delhi,  Delhi/NCR,  Gurgaon,  Mumbai",3 - 8 Years
Senior Accountant,Final Round,Kolkata,5 - 6 Years
Software Application Developer,Electrobrain modern technologies pvt ltd,"Delhi,  Delhi/NCR,  Gurgaon,  Mumbai,  Noida/Greater Noida",3 - 8 Years
Centre Head - J48373,SAMPOORNA CONSULTANTS PVT LTD,"Bengaluru / Bangalore,  Chennai",15 - 20 Years
Quality Associate,Electrobrain modern technologies pvt ltd,"Delhi,  Delhi/NCR,  Gurgaon,  Noida/Greater Noida,  Pune",3 - 8 Years
Business Analyst,Electrobrain modern technologies pvt ltd,"Delhi,  Delhi/NCR,  Gurgaon,  Noida/Greater Noida,  Faridabad",3 - 8 Years
"Data Entry ,  Back Office ,  Computer Operator",Laxmi Infotech,"Delhi/NCR,  Mumbai,  Pune",0 - 3 Years
"network engineer , Software Engineer , Software Developer",RADKO INFOTECH,Chennai,0 - 1 Years
"Jobs in  Automation c# ,  SDET ,  testing UAT ,  Selenium with Java",White Horse Manpower Consultancy P Ltd,"Hyderabad/Secunderabad,  Pune,  Visakhapatnam",3 - 8 Years
Web development internship in Pune,Maxgen Technologies,"Pune,  Jalgaon,  Kolhapur,  Nasik,  Solapur",0 - 1 Years
Senior Analyst - Data Science,Electrobrain modern technologies pvt ltd,"Delhi,  Delhi/NCR,  Gurgaon,  Mumbai,  Noida/Greater Noida",2 - 7 Years
Cyber security Internship,Sparks To Ideas,Ahmedabad,0 - 1 Years
Data Analyst Internship in Pune,Maxgen Technologies,"Pune,  Jalgaon,  Kolhapur,  Nasik,  Solapur",0 - 1 Years
Web Development Internship in Ahmedabad,Maxgen Technologies,Ahmedabad,0 - 1 Years
Java Internship in Pune,Maxgen Technologies,"Pune,  Amravati,  Dhule,  Sangli,  Satara",0 - 1 Years
Full Stack Internship in Pune,Maxgen Technologies,Pune,0 - 1 Years
Assistant General Manager  ( Logistics  &  Supply chain ),Suman kumar,"Delhi/NCR,  Kolkata,  Pune,  Indore,  Bhubaneshwar",15 - 20 Years
Desktop Engineers Required in Canada under PR visa,World Overseas immigration Consultancy Pvt Ltd,"Australia,  Canada",2 - 7 Years
JD Edwrads Manufacturing Consultant,LTIMindtree Ltd.,"Delhi/NCR,  Kolkata",4 - 9 Years
Accounts  &  Finance Manager,Ample Leap Cognition,Gurgaon,10 - 15 Years
Group HR Head  ( Core HR ),Ample Leap Cognition,Pune,20 - 25 Years
System Analyst Required in Austria  ( Europe ) Under work visa,World Overseas immigration Consultancy Pvt Ltd,"Australia,  Canada,  Germany,  null",3 - 8 Years
Opportunities for Network Administrator in Canada,World Overseas immigration Consultancy Pvt Ltd,"Australia,  Canada",2 - 7 Years
Aircraft Mechanical maintenance engineer,sachin kumar,"Ahmedabad,  Bengaluru / Bangalore,  Chennai,  Hyderabad/Secunderabad,  Kolkata",0 - 3 Years
React js Internship in Pune,Maxgen Technologies,"Pune,  Jalgaon,  Kolhapur,  Nasik,  Solapur",0 - 1 Years
Web Engineer  ( Frontend ),Electrobrain modern technologies pvt ltd,"Delhi,  Delhi/NCR,  Gurgaon,  Mumbai,  Faridabad",3 - 8 Years
Want Python  interns,Sparks To Ideas,Ahmedabad,0 - 1 Years
Java Developer Internship in Pune,Maxgen Technologies,"Pune,  Jalgaon,  Kolhapur,  Nasik,  Solapur",0 - 1 Years
Data Analyst Internship in Pune,Maxgen Technologies,Pune,0 - 1 Years
Python Developer,SKYWALK VISA IMMIGRATION SERVICES LLP,"Bengaluru / Bangalore,  Australia,  Canada,  Germany,  New Zealand",3 - 8 Years
Test Automation Engineer,Electrobrain modern technologies pvt ltd,"Delhi,  Delhi/NCR,  Gurgaon,  Noida/Greater Noida,  Pune",3 - 8 Years
JD Edwrads CNC,LTIMindtree Ltd.,"Delhi/NCR,  Kolkata",4 - 9 Years
INTERNSHIP FOR FRESHERS IN PHP,Sparks To Ideas,Ahmedabad,0 - 1 Years
Java Internship in Pune,Maxgen Technologies,"Pune,  Amravati,  Dhule,  Sangli,  Satara",0 - 1 Years
Project Manager PMP CPAM,White Horse Manpower Consultancy P Ltd,"Bengaluru / Bangalore,  Chennai,  Pune",12 - 17 Years
PROFESSOR /  ASSOCIATE / ASTT. PROFESSOR - COMPUTER SCIENCE,SNJ Skye Management Consultant,Kanpur,1 - 6 Years
OIC Developer,LTIMindtree Ltd.,"Bengaluru / Bangalore,  Chennai,  Delhi/NCR,  Kolkata,  Mumbai",3 - 8 Years
Service Delivery Manager - J48414,SAMPOORNA CONSULTANTS PVT LTD,Bengaluru / Bangalore,18 - 23 Years
Python Live Project Internship,Sparks To Ideas,Ahmedabad,0 - 1 Years
Team lead  /  International Customer Service - Voice,White Horse Manpower Consultancy P Ltd,"Bengaluru / Bangalore,  Chennai,  Hyderabad/Secunderabad",0 - 3 Years
"""Frontend Engineer""",KANDPAL CONSULTANT,"Bengaluru / Bangalore,  Delhi,  Hyderabad/Secunderabad,  Pune,  Chandigarh",3 - 4 Years
"Test Automation Engineer  , Software Test Automation Engineer",SHREE ADISHAKTHI CONSULTANCY,"Bengaluru / Bangalore,  Chennai,  Mumbai,  Pune",4 - 8 Years
Software Developer,Medicca Limited,"Bengaluru / Bangalore,  Chennai,  Hyderabad/Secunderabad,  Mumbai,  Navi Mumbai",2 - 7 Years
"content writer , Technical Writer , seo",Laxmi Infotech,"Gurgaon,  Kolkata,  Mumbai,  Noida/Greater Noida,  Pune",0 - 3 Years
PHP / Wordpress Developer,Reliqus,Delhi,0 - 1 Years
Senior Software Testers,Navyah Immigration Services Private Limited,"Dubai,  Australia,  Canada,  Japan,  null",2 - 5 Years
Python Internship for freshers,Sparks To Ideas,Ahmedabad,0 - 1 Years
"""Hardware  &  Networking Engineer""",Suresh Gopalan Acharya,Mumbai,1 - 4 Years
Website Designer Intern,Reliqus,Delhi,0 - 1 Years
General Ledger Accountant,Addenda Chemical India Private Limited,Gurgaon,3 - 8 Years
"content writer , Technical Writer , seo",Laxmi Infotech,"Bengaluru / Bangalore,  Chennai,  Delhi,  Hyderabad/Secunderabad",0 - 3 Years
"Manual Testing with Enterprise Networking Experience ,  Bangalore",White Horse Manpower Consultancy P Ltd,Bengaluru / Bangalore,5 - 10 Years
Project Manager  /  Delivery Manager,HR Jobs Placements,"Bengaluru / Bangalore,  Chennai,  Delhi/NCR,  Kolkata,  Mumbai",8 - 13 Years
Python Internship for freshers,Sparks To Ideas,Ahmedabad,0 - 1 Years
Java Internship in Pune,Maxgen Technologies,"Pune,  Amravati,  Dhule,  Sangli,  Satara",0 - 1 Years
Database Administrator Required in Canada under PR visa,World Overseas immigration Consultancy Pvt Ltd,"Australia,  Canada",2 - 7 Years
QA Analyst II,Electrobrain modern technologies pvt ltd,"Ahmedabad,  Bengaluru / Bangalore,  Chennai,  Mumbai",3 - 8 Years
SAP Consultant,Aerro outsourcing pvt ltd,"Abu Dhabi,  Dubai,  Australia,  Canada,  Hong Kong",1 - 6 Years
"Software Analyst , Programmer Analyst  ( Java )  , Ui Designer",RADKO INFOTECH,Chennai,0 - 1 Years
JD Edwrads S & D Consultant,LTIMindtree Ltd.,"Bengaluru / Bangalore,  Chennai,  Hyderabad/Secunderabad,  Mumbai,  Pune",4 - 9 Years
"Software Developer , Developer",Upholic Tech Private Limited,"Mumbai,  Thane",1 - 3 Years
JD Edwrads Finance Consultant,LTIMindtree Ltd.,"Bengaluru / Bangalore,  Chennai,  Hyderabad/Secunderabad,  Mumbai,  Pune",4 - 9 Years
Python Internship in Pune,Maxgen Technologies,Pune,0 - 1 Years
Junior Legal Associate,Cyberpolicies,"Delhi,  Delhi/NCR",2 - 4 Years
Workday Functional Consultant,LTIMindtree Ltd.,"Bengaluru / Bangalore,  Kolkata,  Mumbai,  Noida/Greater Noida,  Pune",3 - 8 Years
Senior OCI admin,LTIMindtree Ltd.,"Bengaluru / Bangalore,  Chennai,  Kolkata,  Mumbai,  Pune",5 - 10 Years
Qa Engineer,Electrobrain modern technologies pvt ltd,"Delhi,  Delhi/NCR,  Gurgaon,  Noida/Greater Noida,  Pune",3 - 8 Years
PROFESSOR /  ASSOCIATE / ASSISTANT PROFESSOR -  BCA,SNJ Skye Management Consultant,Kanpur,0 - 3 Years
JD Edwards Technical Consultant,LTIMindtree Ltd.,"Bengaluru / Bangalore,  Delhi,  Hyderabad/Secunderabad,  Mumbai,  Pune",4 - 9 Years
IT MANAGER,HR Jobs Placements,"Hyderabad/Secunderabad,  Kolkata,  Mumbai,  Noida/Greater Noida,  Pune",7 - 12 Years
MERN stack Developer,National Institute For Career Education,"Ahmedabad,  Bengaluru / Bangalore,  Chennai,  Hyderabad/Secunderabad,  Kolkata",0 - 3 Years
Full Stack Internship in Pune,Maxgen Technologies,"Pune,  Jalgaon,  Kolhapur,  Nasik,  Solapur",0 - 1 Years
"Software  Test  Engineer , Testing Engineer",SHREE ADISHAKTHI CONSULTANCY,"Bengaluru / Bangalore,  Chennai,  Mumbai,  Pune",4 - 8 Years
"Mis Executive , Sales Coordinator",New Global Technologies,"Ahmedabad,  Delhi/NCR,  Gurgaon,  Kolkata,  Noida/Greater Noida",0 - 3 Years
Azure Devops Engineer,Laxmi Infotech,"Ahmedabad,  Delhi,  Gurgaon,  Kolkata,  Mumbai",3 - 8 Years
Senior Angular Developer,White Horse Manpower Consultancy P Ltd,"Bengaluru / Bangalore,  Mumbai,  Pune",5 - 10 Years
Senior .net Developer,White Horse Manpower Consultancy P Ltd,"Bengaluru / Bangalore,  Mumbai,  Pune",5 - 10 Years
Senior Infrastructure Engineer,White Horse Manpower Consultancy P Ltd,"Bengaluru / Bangalore,  Mumbai,  Pune",2 - 7 Years
Flash Animator  /  Multimedia graphics designer,Laxmi Infotech,"Ahmedabad,  Gurgaon,  Kolkata,  Noida/Greater Noida",0 - 3 Years
Senior Full Stack Developer,White Horse Manpower Consultancy P Ltd,"Bengaluru / Bangalore,  Mumbai,  Pune",5 - 10 Years
Manual Test Engineer,Electrobrain modern technologies pvt ltd,"Delhi,  Delhi/NCR,  Gurgaon,  Mumbai,  Noida/Greater Noida",3 - 6 Years
BPO AP Lead,White Horse Manpower Consultancy P Ltd,"Bengaluru / Bangalore,  Mumbai,  Pune",10 - 15 Years
"Mis Executive , Sales Coordinator",New Global Technologies,"Bengaluru / Bangalore,  Chennai,  Hyderabad/Secunderabad,  Mumbai,  Pune",0 - 3 Years
"Quality Analyst Technical Support Process ,  QA TSE",White Horse Manpower Consultancy P Ltd,Bengaluru / Bangalore,1 - 6 Years
Business Analyst,LTIMindtree Ltd.,"Bengaluru / Bangalore,  Chennai,  Mumbai,  Pune",1 - 2 Years
